file_name,uni,wylie,url,dept,grade,char_len,audio_len,path,inf
STT_TT00847_0004_18002_to_25461,བདག་གིས་སྦྱིན་སོགས་བགྱིས་པའི་ཚོགས་རྣམས་ཀྱིས། འགྲོ་ལ་ཕན་ཕྱིར་སངས་རྒྱས་འགྲུབ་པར་ཤོག། སངས་རྒྱས་ཆོས་དང་ཚོགས་ཀྱི་མཆོག་རྣམས་ ,bdag gis sbyin sogs bgyis pa'i tshogs rnams kyis/_'gro la phan phyir sangs rgyas 'grub par shog/_sangs rgyas chos dang tshogs kyi mchog rnams _,https://d38pmlk0v88drf.cloudfront.net/wav16k/STT_TT00847_0004_18002_to_25461.wav,STT_TT,2,119,7.459,wav16k/STT_TT00847_0004_18002_to_25461.wav,བདག་གིས་ཚོགས་ཤོས་བགྱིས་པའི་ཚོགས་རྣམས་ཀྱིས། འགྲོ་ལ་ཕན་ཚུན་སངས་རྒྱས་འགྲུབ་པར་ཤོག། སངས་རྒྱས་ཆོས་དང་ཚོགས་ཀྱི་མཆོག་རྣམས།
STT_MV0900_0332_2227657_to_2234551,འདིའི་རྒྱུད་ཀི་ཆུ་དེ་རང་གིས་བཤང་ཐུབ་ཀི་མ་རེད། ཝོས་སུང་གིས་སྟག་བསད་ཐུབ་པ་རེད་དེ།  ,'di'i rgyud ki chu de rang gis bshang thub ki ma red/_wos sung gis stag bsad thub pa red de/__,https://d38pmlk0v88drf.cloudfront.net/wav16k/STT_MV0900_0332_2227657_to_2234551.wav,STT_MV,2,81,6.894,wav16k/STT_MV0900_0332_2227657_to_2234551.wav,དེའི་རྒྱུད་ཀི་ཆུ་དེ་རང་གིས་བཤངས་ཐུབ་ཀི་མ་རེད། འོས་སུང་གིས་རྟ་གསད་ཐུབ་པ་རེད་དེ།
STT_TT00851_0450_2936837_to_2940533,ཨོ་དེ་ཡེ་ཡག་པོ་འདུག་བ། དེ་ཡེ་ཡག་པོ་འདུག་བ་ཟེ་བྱས་ཙང་། བོད་པ་ཟེར་ཡ་དེ་དཔེ་ཡག་པོ་ཡོད་རེད་ཟེར་ཡ་འདྲ་བོ།  ,o de ye yag po 'dug ba/_de ye yag po 'dug ba ze byas tsang /_bod pa zer ya de dpe yag po yod red zer ya 'dra bo/__,https://d38pmlk0v88drf.cloudfront.net/wav16k/STT_TT00851_0450_2936837_to_2940533.wav,STT_TT,2,102,3.696,wav16k/STT_TT00851_0450_2936837_to_2940533.wav,ཨོ་དེ་ཡ་ཡག་པོ་འདུག་ག། དེ་ཡག་པོ་འདུག་ག་ཟེ་བྱས་ཙང་། བོད་པ་ཟེར་ཡ་དེ་དཔེ་ཡག་པོ་ཡོད་རེད་ཟེར་ཡ་འདྲ་བོ།
STT_MV0900_0309_2087006_to_2091332,ངས་རླུང་གིས་ཟེར་ག་བྱས། ཀན་ཧྥིང་རུང་རང་སྒུགས་ཨ། དེ་རིང་ཡིན་ན་ངས། ཨ་ཙི།  ,ngas rlung gis zer ga byas/_kan h+phing rung rang sgugs a/_de ring yin na ngas/_a tsi/__,https://d38pmlk0v88drf.cloudfront.net/wav16k/STT_MV0900_0309_2087006_to_2091332.wav,STT_MV,2,71,4.326,wav16k/STT_MV0900_0309_2087006_to_2091332.wav,ཁས་ལོང་བསྟ་གིན་ཟེར་ག་བྱས། ཀ་པིན་རུང་། རང་སྒུགས་ཨ། དེ་རིང་ཡིན་ན་ངས།
STT_MV0900_0310_2091332_to_2101331,རང་ལ་སློབ་གསོ་ཡག་པོ་བརྒྱབ་མ་སོང་ཟེར་གི་འདུག་ད། ངས་སྒུགས་ཨ། ངས། པཱ་ལགས། ཧྥིང་རུང་། བུ་མོ་སོང་ཙང་གཞུས་ན་ཡོང་གི་མ་རེད། བུ་མོ་རེད་ཟེར་ཨེ། དེ་རིང་ངས་མ་བཅུན་པ་ཡིན་ན། རྗེས་མ་ཆག་སྒོ་ཆེན་པོ་བསླངས་པ།  ,rang la slob gso yag po brgyab ma song zer gi 'dug da/_ngas sgugs a/_ngas/_pA lags/_h+phing rung /_bu mo song tsang gzhus na yong gi ma red/_bu mo red zer e/_de ring ngas ma bcun pa yin na/_rjes ma chag sgo chen po bslangs pa/__,https://d38pmlk0v88drf.cloudfront.net/wav16k/STT_MV0900_0310_2091332_to_2101331.wav,STT_MV,2,191,9.999,wav16k/STT_MV0900_0310_2091332_to_2101331.wav,རང་ལ་སློབ་གསོ་ཡག་པོ་ཞིག་རྒྱབ་མ་སོང་བཟོས་སོང་ན། ངས་རྐུ་སླངརོང་ངས། ངའི་ལྟས་ཡི་ང། དན་པ་བུ་མོ་སོང་ཙང་ཞེད་ན་ཡོང་གི་མ་རེད། བུ་མོ་རེད་ཟེར་ཨེ། དེ་རིང་ངས་མ་བྱུན་པ་ཡིན་ན། རྗེས་མ་ཆག་སྒོ་ཆེན་པོ་བསླངས་པ།
STT_MV0900_0312_2102332_to_2110759,ཨ་མ་ལགས་ཀིས་བུས་བུ་མོར་གཞུ་ཉེན་གི་མ་རེད་གསུང་གིས། དེ་བས་པཱ་ལགས་ཀིས་བུ་མོར་གཞུས་ན་ཡོང་གི་མ་རེད་བ། རང་གི་ཨ་མས་ནོར་འཁྲུལ་ཤོར་ནས་ངས་རང་གི་ཨ་མའི། རང་དེ་རིང་ག་བར་ཕྱིན་པ་ཨ།  ,a ma lags kis bus bu mor gzhu nyen gi ma red gsung gis/_de bas pA lags kis bu mor gzhus na yong gi ma red ba/_rang gi a mas nor 'khrul shor nas ngas rang gi a ma'i/_rang de ring ga bar phyin pa a/__,https://d38pmlk0v88drf.cloudfront.net/wav16k/STT_MV0900_0312_2102332_to_2110759.wav,STT_MV,2,167,8.427,wav16k/STT_MV0900_0312_2102332_to_2110759.wav,ཨ་མ་ལགས་ཀིས་བུས་བུ་མོར་ཞུ་ཉན་གི་མ་རེད་གསུང་ཀིས། དེ་ལས་པཱ་ལགས་ཀིས་བུ་མོར་ཞུས་ན་ཡོང་གི་མ་རེད་ད། རང་གི་ཨ་མས་ནོར་འཁྲུལ་ཤོར་ནས། ངས་རང་གི་ཨ་མའས། རང་དེ་རིང་ག་བར་ཕྱིན་པ་ཨ།
STT_MV0900_0314_2114366_to_2122318,པཱ་ལགས། ཁྱེད་རང་ཨ་མ་ལགས་སྐོར་ཞུས་པ་དང་ལམ་སང་སྐུ་རླུང་བཞེངས་འགྲོ་གིས། འགྲིག་སོང་། དེ་རིང་ངས་ནོར་ཤག སང་ཉིན་ནས་ངས་ག་ས་ག་ལ་ཕྱིན་མི་ཡོང་། ནང་ལ་བསྡད་བྱས་ ,pA lags/_khyed rang a ma lags skor zhus pa dang lam sang sku rlung bzhengs 'gro gis/_'grig song /_de ring ngas nor shag_sang nyin nas ngas ga sa ga la phyin mi yong /_nang la bsdad byas _,https://d38pmlk0v88drf.cloudfront.net/wav16k/STT_MV0900_0314_2114366_to_2122318.wav,STT_MV,2,148,7.952,wav16k/STT_MV0900_0314_2114366_to_2122318.wav,པཱ་ལགས། ཁྱེད་རང་ལ་ཨ་མ་ལགས་ཀི་སྐོར་བཞུས་ད། ལམ་སང་སྐུ་ྒུར་བཞག་འགྲོ་གི་ཡིན། འགྲིག་སོང། ད་རིང་ངས་ནོར་ཤག སང་ཉིན་ནས་ངས་ག་ས་ག་ལ་ཕྱིན་མི་ཡོང་། ནང་ལ་བསྡད་བྱས།
STT_MV0900_0318_2142729_to_2151970,དེ་རིང་གི་དོན་དག་དེ་ཨ་མ་ལོག་སླེབས་དུས་ཁྱོན་ནས་མ་ཤོད་ལ། གོ་བྱུང་ངེ་། འོ་ཡ། ལགས་སོ། ད་སྦྱོང་ཚན་འབྲི་གར་རྒྱུགས་ཤིག ཧེ་ཧེ་ཧེ་། ཧ་ཧ་ཧ་ ,de ring gi don dag de a ma log slebs dus khyon nas ma shod la/_go byung nge /_'o ya/_lags so/_da sbyong tshan 'bri gar rgyugs shig_he he he /_ha ha ha _,https://d38pmlk0v88drf.cloudfront.net/wav16k/STT_MV0900_0318_2142729_to_2151970.wav,STT_MV,2,130,9.241,wav16k/STT_MV0900_0318_2142729_to_2151970.wav,དེ་རིང་གི་དོན་དག་དེ་ཨ་མ་ལོག་སླེབས་དུས་ ཁྱོན་ནས་མ་ཤོད་ལ། གོ་བྱུང་ངེ་། ཝོ་ཡེ། ལ་སོ། ད་སྦྱོང་ཚན་འབྲི་ག་རྒྱུགས་ཤིག ཧཧ་ཧ
STT_AB00554_0065_375605_to_382559,གཙུག་ལག་ཁང་ཞིག་མ་ཡིན་པར། བོད་ཀྱི་ཆོས་སྲིད་རིག་གནས་ཀྱི་ལྟེ་གནས་གཙོ་བོ་ཞིག་ཏུ་གྱུར་པའི་ཐོག ཕྱི་ནང་གི་བཀོད་པ་ནི་ ,gtsug lag khang zhig ma yin par/_bod kyi chos srid rig gnas kyi lte gnas gtso bo zhig tu gyur pa'i thog_phyi nang gi bkod pa ni _,https://d38pmlk0v88drf.cloudfront.net/wav16k/STT_AB00554_0065_375605_to_382559.wav,STT_AB,2,110,6.954,wav16k/STT_AB00554_0065_375605_to_382559.wav,གཙུག་ལག་ཁང་ཞིག་མ་ཡིན་པར་ བོད་ཀྱི་ཆོས་སྲིད་རིག་གནས་ཀྱི་ལྟེ་གནས་གཙོ་བོ་ཞིག་ཏུ་གྱུར་པའི་ཐོག ཕྱི་ནང་གི་བཀོད་པ་ནི།
STT_MV0900_0320_2156449_to_2165862,པུ་གུ་འདི་གས་ལ་ལྟ་རྟོག་བྱེད་དགོས་དུས་ང་དེ་སྔོན་ཤིང་ཅང་དམག་ཁུལ་གི་མཁོ་སྒྲུབ་པུའུ་གི་པུའུ་ཀྲང་བྱས་པ་ལས་དཀའ་ལས་ཁག་ག་ ,pu gu 'di gas la lta rtog byed dgos dus nga de sngon shing cang dmag khul gi mkho sgrub pu'u gi pu'u krang byas pa las dka' las khag ga _,https://d38pmlk0v88drf.cloudfront.net/wav16k/STT_MV0900_0320_2156449_to_2165862.wav,STT_MV,2,114,9.413,wav16k/STT_MV0900_0320_2156449_to_2165862.wav,བུ་གུ་དེ་གས་ལ་ལྟ་རྟོག་བྱེད་དགོས་དུས། ང་དེ་སྔོན་ཤིང་ཅང་དམག་པུལ་གི་མཁོ་སྒྲུག་པུའུ་གུ་དབུའ་ཀྲང་བྱས་པ་ལས་དཀའ་ལས་ཁག་ག
STT_MV0900_0322_2170743_to_2176391,ཡིན་ནས། ཐབས་ཤེས་འདི་འདྲས་ཀིས་ཡོང་བ་མི་འདུག ཐང་ཤིང་ཟེར་ཡ་དེ་ཆུའི་ནང་ལ་གནས་ཐུབ་ཀི་མ་རེད།  ,yin nas/_thabs shes 'di 'dras kis yong ba mi 'dug_thang shing zer ya de chu'i nang la gnas thub ki ma red/__,https://d38pmlk0v88drf.cloudfront.net/wav16k/STT_MV0900_0322_2170743_to_2176391.wav,STT_MV,2,88,5.648,wav16k/STT_MV0900_0322_2170743_to_2176391.wav,ཡིན་ནས་ཐབས་ཤེས་དི་འདྲས་ཀིས་ཡོང་ང་མི་འདུག ཐང་ཤིང་ཟེར་ཡ་དེ་ཆུའི་ནང་ལ་གནས་ཐུབ་ཀི་མ་རེད།
STT_AB00322_1108_6026578_to_6030264,གསུམ་པ་ལས་གང་འབྲས་བུ་དུ་དང་བཅས་པ་ནི།  ,gsum pa las gang 'bras bu du dang bcas pa ni/__,https://d38pmlk0v88drf.cloudfront.net/wav16k/STT_AB00322_1108_6026578_to_6030264.wav,STT_AB,2,38,3.686,wav16k/STT_AB00322_1108_6026578_to_6030264.wav,གསུམ་པ་ལས་གང་འབྲས་བུ་དུ་དང་བཅས་པ་ནི།
STT_MV0900_0324_2182372_to_2189980,ཨ་ཙི། ཞིང་ཁའི་ནང་ལུད་མེད་ཙང་། ཞིང་ཁ་ག་འདྲས་སེ་བཏབ་དགོས་རེད། མི་གྲོད་ཁོག་མ་རྒྱག་པ་ཡིན་ན་ལྟོགས་ཤི་ཐེབས་པ་དང་གཅིག་པ་རེད།  ,a tsi/_zhing kha'i nang lud med tsang /_zhing kha ga 'dras se btab dgos red/_mi grod khog ma rgyag pa yin na ltogs shi thebs pa dang gcig pa red/__,https://d38pmlk0v88drf.cloudfront.net/wav16k/STT_MV0900_0324_2182372_to_2189980.wav,STT_MV,2,119,7.608,wav16k/STT_MV0900_0324_2182372_to_2189980.wav,ཨ་ཙི། ཞིང་ཁའི་ནང་ལ་ལུས་མེད་ཙང་། ཞིང་ཁས་ག་འདྲས་སེ་བཏབ་དགོས་རེད། མིའི་གྲོད་ཁོག་མ་རྒྱགས་པ་ཡིན་ན། ལྟོགས་ཤི་ཐེབས་པ་དང་གཅིག་པ་རེད།
STT_AB00317_1397_4593080_to_4593779,ཡོད་མ་ཡིན།  ,yod ma yin/__,https://d38pmlk0v88drf.cloudfront.net/wav16k/STT_AB00317_1397_4593080_to_4593779.wav,STT_AB,2,12,0.699,wav16k/STT_AB00317_1397_4593080_to_4593779.wav,ཡོད་མ་ཡིན།
STT_MV0900_0326_2191772_to_2197873,ང་སྤོར་ཏོ་འདིར་སྦིལ་ལ་སེལ་པོ་གང་འདྲས་མི་འདུག ཁྱེད་རང་ཚོས་ཀླད་པ་དཀྲུགས་བྱས་ཐབས་ཤེས་ཤིག་གཏོང་ད་ ,nga spor to 'dir sbil la sel po gang 'dras mi 'dug_khyed rang tshos klad pa dkrugs byas thabs shes shig gtong da _,https://d38pmlk0v88drf.cloudfront.net/wav16k/STT_MV0900_0326_2191772_to_2197873.wav,STT_MV,2,94,6.101,wav16k/STT_MV0900_0326_2191772_to_2197873.wav,ང་སྤོར་ཏོ་འདིར་སྦི་ལ་སིལ་པོ་ག་འདྲས་མི་འདུག ཁྱེད་རང་ཚོའི་ཀླད་པ་དཀྲུགས་བྱས་ཐབས་ཤེས་ཤིག་གཏོང་ད།
STT_MV0660_0262_1711400_to_1715895,ཧྥང་སོ་ཙེ་མེད་ན་ཁག་སེ་བྱེད་ཀི་མ་རེད་པེ། ང་རང་གཉིས་ ,h+phang so tse med na khag se byed ki ma red pe/_nga rang gnyis _,https://d38pmlk0v88drf.cloudfront.net/wav16k/STT_MV0660_0262_1711400_to_1715895.wav,STT_MV,2,51,4.495,wav16k/STT_MV0660_0262_1711400_to_1715895.wav,ཧྥང་རྫོས་ས་མེད་ན་ ཁག་སེ་བྱེད་ཀི་མ་རེད་པེ། ང་རང་གཉིས།
STT_MV0660_0263_1715895_to_1725401,གཅིག་ཕན་གཅིག་རོགས་རེད་པ། བཞག་རོགས་གྱིས། ག་རེའི་གཅིག་ཕན་གཅིག་རོགས། ཡ། རྨའེ་ཤང་གི་བུ་མོ་མ་རེད་པེ། ཅང་ཧྥང་ཟེར།  ,gcig phan gcig rogs red pa/_bzhag rogs gyis/_ga re'i gcig phan gcig rogs/_ya/_rma'e shang gi bu mo ma red pe/_cang h+phang zer/__,https://d38pmlk0v88drf.cloudfront.net/wav16k/STT_MV0660_0263_1715895_to_1725401.wav,STT_MV,2,109,9.506,wav16k/STT_MV0660_0263_1715895_to_1725401.wav,གཅིག་ཕན་གཅིག་རོགས་རེད་པ། བཞག་རོགས་གྱིས། ག་རེའི་གཅིག་ཕན་གཅིག་རོགས། ཧ། ཡ རྨའེ་ཤང་གི་བུ་མོ་མ་རེད་པེ། ཅིང་ཧྥིང་ཟ།
STT_MV0660_0264_1726522_to_1729424,ལང་ཚོ་དར་ལ་བབས་བྱས། སྙིང་རྗེ་སེ་ཆགས་འདུག་ག ,lang tsho dar la babs byas/_snying rje se chags 'dug ga_,https://d38pmlk0v88drf.cloudfront.net/wav16k/STT_MV0660_0264_1726522_to_1729424.wav,STT_MV,2,43,2.902,wav16k/STT_MV0660_0264_1726522_to_1729424.wav,ལང་ཚོ་དར་ལ་བབས་བྱས་ སྙིང་རྗེ་སེར་ཆགས་འདུག་ག
STT_MV0660_0265_1729424_to_1733617,མོ་རང་ཨ་མ་ཆུང་དུས་ད་གཅིག་པ་གཅིག་རྐྱང་རེད་ཤག ཨ་མ་ལས་སྙིང་རྗེ།  ,mo rang a ma chung dus da gcig pa gcig rkyang red shag_a ma las snying rje/__,https://d38pmlk0v88drf.cloudfront.net/wav16k/STT_MV0660_0265_1729424_to_1733617.wav,STT_MV,2,62,4.193,wav16k/STT_MV0660_0265_1729424_to_1733617.wav,མོ་རང་ཨ་མ་ཆུང་དུས་དང་གཅིག་པ་གཅིག་རྐྱང་རེད་ཤག ཨ་མ་ལིས་སྙིང་རྗེ།
STT_MV0900_0327_2197873_to_2205860,གང་འདྲས་འདུག་ཨ། ཧ་ཧ་ཧ་ ཨ་ཁུ། ཨ། ཨ་ཁུ་རང་བློ་བདེ་པོ་གྱིས་ཤིག ཆུ་ཞིང་བདག་སྐྱོང་བྱེད་ཡ་དེ་ཡན་པན་གྲོང་ཚོའི་དོན་ཆེན་རེད།  ,gang 'dras 'dug a/_ha ha ha _a khu/_a/_a khu rang blo bde po gyis shig_chu zhing bdag skyong byed ya de yan pan grong tsho'i don chen red/__,https://d38pmlk0v88drf.cloudfront.net/wav16k/STT_MV0900_0327_2197873_to_2205860.wav,STT_MV,2,117,7.987,wav16k/STT_MV0900_0327_2197873_to_2205860.wav,ག་འདྲས་འདུག་ཨ། ཧ་ཧ་ཧ་། ཨ་ཁུ། ཨ། ཨ་ཁུ་རང་བློ་བདེ་པོ་གྱིས་ཤིག ཆུ་ཤིབ་བརྡག་སྐྱོང་བྱེད་ཡ་དེ་ ཡན་པན་གྲོང་ཚོའི་དོན་ཆེན་རེད།
STT_MV0647_0285_1909921_to_1916523,ངས་ཏ་ཝང་ལ་སྐད་ཆ་བྱས་ཚར། ད་རེས་ས་ཕག་ལེན་ཚར་པ་བྱེད་ཡ་ཡིན། ཟ་མྱི་སྡོད་མྱི་དེ་ལུ་ཝོས་ཁོ་ཚོའི་ནང་ནས་དྲུད་འཐེན་འཕྲུལ་འཁོར་གཡར་བྱས། དབོར་རྩིས་ཡོད།  ,ngas ta wang la skad cha byas tshar/_da res sa phag len tshar pa byed ya yin/_za myi sdod myi de lu wos kho tsho'i nang nas drud 'then 'phrul 'khor g.yar byas/_dbor rtsis yod/__,https://d38pmlk0v88drf.cloudfront.net/wav16k/STT_MV0647_0285_1909921_to_1916523.wav,STT_MV,2,141,6.602,wav16k/STT_MV0647_0285_1909921_to_1916523.wav,ངས་ཏཱ་ཝང་དང་སྐད་ཆ་བྱས་ཚར། དེ་རིང་ས་ཕག་ལན་ཚར་པ་བྱེད་ཡ་ཡིན། བཟའ་ནས་བསྟས་མྱི་གི་ལཡུད་ཁོང་ཚོའི་ནང་ནས། གྲོས་མཐེན་གྲུལ་ཁ་གཡར་བྱས་དབུ་རྩིས་ཡོད།
STT_MV0647_0287_1921304_to_1927732,ཨ་ཡེ། ངས་ཐང་དཀར་རིལ་གཅིག་ད་གཏང་མྱོང་ཡོད། དྲུད་འཐེན་འཕྲུལ་འཁོར་གཅིག་གཏང་མ་ཐུབ་ཡ་ག་རེ་ཡོད་རེད། ཧ་ཧ། ཨ་ཙོ། རྒྱུན་རིང་པོ་བཏང་མེད་པ། ལམ་ཀ་ལ ,a ye/_ngas thang dkar ril gcig da gtang myong yod/_drud 'then 'phrul 'khor gcig gtang ma thub ya ga re yod red/_ha ha/_a tso/_rgyun ring po btang med pa/_lam ka la_,https://d38pmlk0v88drf.cloudfront.net/wav16k/STT_MV0647_0287_1921304_to_1927732.wav,STT_MV,2,135,6.428,wav16k/STT_MV0647_0287_1921304_to_1927732.wav,ངས་ཐང་གི་ར་ཞིག་ད་བྟང་མྱོང་ཡོད། གྲོས་བམཐུན་དྲི་ཁོག་ཅིག་གཏང་མ་ཐུབ་པ་ག་རེ་ཡོད་རེད། ཧ། ཨ་ཙི། རྒྱུན་རིང་པོ་བཏང་མེད་པ། ལམ་ག་ལ།
STT_AB00322_1109_6030605_to_6035674,འོ་ན། ལས་གང་འབྲས་བུ་དུ་དང་བཅས་པ་ཡིན་ཞེ་ན། རྩ་བ་ལས།  ,'o na/_las gang 'bras bu du dang bcas pa yin zhe na/_rtsa ba las/__,https://d38pmlk0v88drf.cloudfront.net/wav16k/STT_AB00322_1109_6030605_to_6035674.wav,STT_AB,2,52,5.069,wav16k/STT_AB00322_1109_6030605_to_6035674.wav,འོ་ན་ལས་གང་འབྲས་བུ་དུ་དང་བཅས་པ་ཡིན་ཞེ་ན། རྩ་བ་ལས།
STT_MV0660_0267_1742653_to_1748979,ཨེ། རང་གིས་ལབ་སེ་གཅིག་གྱིས་ད། ང་འདྲིས་མིག་གཅིག་བལྟ་དགོས་བསམ་གིན། རྒྱུགས་ད།  ,e/_rang gis lab se gcig gyis da/_nga 'dris mig gcig blta dgos bsam gin/_rgyugs da/__,https://d38pmlk0v88drf.cloudfront.net/wav16k/STT_MV0660_0267_1742653_to_1748979.wav,STT_MV,2,76,6.326,wav16k/STT_MV0660_0267_1742653_to_1748979.wav,ཝེ། རང་གིས་ལབ་སེ་གྱིས་ད། ང་སྒྲིག་མེད་གཅིག་ལྟ་དགོས་བསམ་གི། དརྒྱུགས་ད།
STT_MV0660_0270_1759431_to_1761790,རང་གི་ཨ་མ་ངེད་གཉིས་ངོ་ཤེས་རྙིང་པ་རེད་ད།  ,rang gi a ma nged gnyis ngo shes rnying pa red da/__,https://d38pmlk0v88drf.cloudfront.net/wav16k/STT_MV0660_0270_1759431_to_1761790.wav,STT_MV,2,41,2.359,wav16k/STT_MV0660_0270_1759431_to_1761790.wav,རང་གི་ཨ་མ་ངེད་གཉིས་ངོ་ཤེས་རྙིང་པ་རེད་ད།
STT_MV0660_0271_1761790_to_1770879,ཧ་ཧ་ཧ། ཅང་ཧྥང་རང་ངོ་ཤེས་ཙང་དགའ་བོ་ཞེ་དྲག་བྱུང། ཡ། ཧ་ཧ། ཅང་ཧྥང་།  ,ha ha ha/_cang h+phang rang ngo shes tsang dga' bo zhe drag byung/_ya/_ha ha/_cang h+phang /__,https://d38pmlk0v88drf.cloudfront.net/wav16k/STT_MV0660_0271_1761790_to_1770879.wav,STT_MV,2,65,9.089,wav16k/STT_MV0660_0271_1761790_to_1770879.wav,ཅིང་ཧྥུང་། རང་ངོ་ཤེས་ཙང་དགའ་པོ་ཞེ་དྲག་བྱུང་། ཡ། ཅིང་ཧྥང་།
STT_MV0660_0273_1792975_to_1801337,སྐད་ཆ་འདྲི་ཡ་གཅིག་ཡོད། ཁྱེད་ཚོའི་གྲོང་ཚོའི་ནང་ལ་གྲེང་ཀྲོས་ཉོས་ཟེར་མྱི་གཅིག་ཡོད་རེད་པེ།  ,skad cha 'dri ya gcig yod/_khyed tsho'i grong tsho'i nang la greng kros nyos zer myi gcig yod red pe/__,https://d38pmlk0v88drf.cloudfront.net/wav16k/STT_MV0660_0273_1792975_to_1801337.wav,STT_MV,2,88,8.362,wav16k/STT_MV0660_0273_1792975_to_1801337.wav,སྐད་ཆ་འདྲི་ཡ་གཅིག་ཡོད། ཁྱེད་ཚོའི་གྲོང་ཚོའི་ནང་ལ་ཁྲེང་ཆུང་ཉོད་ཟེར་མྱི་གཅིག་ཡོད་རེད་པེ།
STT_MV0660_0274_1801337_to_1811336,ཡོད་རེད། ནང་ཕར་ཁའི་རེད། འོ། ཕར་ཁའི་འདུག ཡོང་གི། གྲེང་ཉོས་རང་བཙལ་མྱི་ཞིག་འདུག ,yod red/_nang phar kha'i red/_'o/_phar kha'i 'dug_yong gi/_greng nyos rang btsal myi zhig 'dug_,https://d38pmlk0v88drf.cloudfront.net/wav16k/STT_MV0660_0274_1801337_to_1811336.wav,STT_MV,2,77,9.999,wav16k/STT_MV0660_0274_1801337_to_1811336.wav,ཡོད་རེད། ནང་ཕ་གི་རེད། ཨོ། ཕ་དེ་འདུག ཡོང་གིས། ཀྲེ་ཉའོ། རང་བཙལ་མྱི་ཞིག་འདུག
STT_MV0647_0290_1950935_to_1960537,འོ་ཙི། ཨུ། ཨ་ཙི་ཁྱེད་གཉིས་གཟབ་གཟབ་གྱིས་ད། ཨ་ཅག་བསྡབ་ཡོང། གཟབ་གཟབ་གྱིས་ད་བསྡབ་ཡོང་ཅེ། ཧེ་ཧེ། གལ་བྱེད་ཀི་མ་རེད། ཨ་ཙི། པུ་གུ་འདི་གཉིས་ཡིན་ན། ང་ཡང་དེ་འདྲས་མེད།  ,'o tsi/_u/_a tsi khyed gnyis gzab gzab gyis da/_a cag bsdab yong/_gzab gzab gyis da bsdab yong ce/_he he/_gal byed ki ma red/_a tsi/_pu gu 'di gnyis yin na/_nga yang de 'dras med/__,https://d38pmlk0v88drf.cloudfront.net/wav16k/STT_MV0647_0290_1950935_to_1960537.wav,STT_MV,2,157,9.602,wav16k/STT_MV0647_0290_1950935_to_1960537.wav,ཨ་ཙི། ཨ་ཙི། ཁྱེད་གཉིས་གཟབ་གཟབ་གྱིས་ད། ཨ་མ་ལགས་ཀི་སྡུག། གཟབ་གཟབ་གྱིས་ད། སྡུག། གེ་བྱེད་ཀི་མ་རེད། ཨ་ཙི པུ་གུ་འདི་གདྲས་འདེ་འདྲས་མེད
STT_MV0900_0347_2371875_to_2377542,ང་རས་བཀྲུ་ཆོག གེ་གནང་གི་མ་རེད་པཱ་ལགས། ཨ་མ་ལགས་བཞུགས་མེད་ཙང་།  ,nga ras bkru chog_ge gnang gi ma red pA lags/_a ma lags bzhugs med tsang /__,https://d38pmlk0v88drf.cloudfront.net/wav16k/STT_MV0900_0347_2371875_to_2377542.wav,STT_MV,2,62,5.667,wav16k/STT_MV0900_0347_2371875_to_2377542.wav,ང་རས་བཀྲུས་ཆོག གེ་གནང་གི་མ་རེད་པ་ལགས། ཨ་མ་ལགས་བཞུགས་མེད་ཙང་།
