file_name,uni,wylie,url,dept,grade,char_len,audio_len,path,inf
STT_MV0900_0168_1159053_to_1168006,ངས་ཤེས་ཀིས། ང་རས་ཨ་ཅེས་ང་རང་བྱམས་ཤོས་བྱེད་ཀི་ཡོད། ཧ་ཧ་། རེད་མ་རེད། འདིར་ཁེར་ཤོག་ད་། ངས་བྱེད་དགོས།  ,ngas shes kis/_nga ras a ces nga rang byams shos byed ki yod/_ha ha /_red ma red/_'dir kher shog da /_ngas byed dgos/__,https://d38pmlk0v88drf.cloudfront.net/wav16k/STT_MV0900_0168_1159053_to_1168006.wav,STT_MV,2,99,8.953,wav16k/STT_MV0900_0168_1159053_to_1168006.wav,ངས་ཤེས་ཀིས། ང་རའི་ཨ་ཅེས་ང་རང་བྱམས་ཤོས་བྱེད་ཀི་ཡོད། ཧ་ཧརེད་མ་རེད། ཧ་ཧ་ཧ། འདིར་ཁེར་ཤོག་ད། ངས་བྱེད་དགོས།
STT_MV0900_0171_1181442_to_1186246,སོ་སོས་ལག་པ་འགུལ་ན་ཟས་གོས་ལ་སེམས་ཁྲལ་མེད་སེ་གསུངས་པ་རེད། རང་གིས་བཟོས།  ,so sos lag pa 'gul na zas gos la sems khral med se gsungs pa red/_rang gis bzos/__,https://d38pmlk0v88drf.cloudfront.net/wav16k/STT_MV0900_0171_1181442_to_1186246.wav,STT_MV,2,71,4.804,wav16k/STT_MV0900_0171_1181442_to_1186246.wav,སོ་སོས་ལག་པ་བསྐུས་ན། ཟས་གོས་ལ་སེམས་ཁྲལ་མེད་ཟེ་གསུངས་པ་རེད། རང་གིས་བཟོད།
STT_MV0900_0173_1195623_to_1200896,ངས་ཨ་ཅེ་གཅིག་གིས་འགན་ཁེར་གི་ཟེར་གི་རེད་བསམ་བྱས། ད་ག་སེ་བྱེད་བཞག་གི་ཡོད། སུས་བཤད་ནུས་སོང་བལྟས་དགོས།  ,ngas a ce gcig gis 'gan kher gi zer gi red bsam byas/_da ga se byed bzhag gi yod/_sus bshad nus song bltas dgos/__,https://d38pmlk0v88drf.cloudfront.net/wav16k/STT_MV0900_0173_1195623_to_1200896.wav,STT_MV,2,100,5.273,wav16k/STT_MV0900_0173_1195623_to_1200896.wav,ངས་ཨ་ཅེ་གཅིག་གིས་འགན་འཁུར་གི་མི་འདུག་ཟེར་གི་རེད་བསམ་བྱས། ད་ག་སེ་བྱས་བཞག་གི་ཡོད། ཨསུས་བཤད་ནོད་སོང་བལྟ་དགོས།
STT_MV0900_0174_1200896_to_1208298,བློ་མཐུན་ཀུང་ཆན་ཀྲན་འཇིག་རྟེན་འདིའི་ཐོག་གི་ཨ་ཅེ་ཡག་ཤོས་དེ་རེད། སུས་དེ་འདྲས་སེ་བཤད་པ་ཡིན་ནས། ངས་ལམ་སང་མི་མདའ་བཏོན་བྱས་ ,blo mthun kung chan kran 'jig rten 'di'i thog gi a ce yag shos de red/_sus de 'dras se bshad pa yin nas/_ngas lam sang mi mda' bton byas _,https://d38pmlk0v88drf.cloudfront.net/wav16k/STT_MV0900_0174_1200896_to_1208298.wav,STT_MV,2,118,7.402,wav16k/STT_MV0900_0174_1200896_to_1208298.wav,བློ་མཐུན་ཀུང་ཆུའེ་ཀྲ་འཇིག་རྟེན་འདིའི་ཐོག་གི་ཨ་ཅེ་ཡག་ཤོས་དེ་རེད། སུས་དི་འདྲས་སེ་བཤད་པ་ཡིན་ནས། ངས་ལམ་སང་མེ་མདའ་བཏོན་བྱས།
STT_MV0900_0172_1186246_to_1195623,ཧ་ཧ་། རང་ལྟོས་ད། ངར་སྟོད་ཐུང་ཅི་དག་གཡོགས་པ་རེད། ད་དུང་ཞབས་ཕྱི་ཞུ་གི་མིན་ཟེར་ག་བྱས། ཧ་ཧ་ཧ་། ཁ་སྙན་པོ་བཤད་མི་དགོས། ང་མི་གཞན་དག་གིས་རྒྱབ་བཤད་བརྒྱབ་བྱས་ ,ha ha /_rang ltos da/_ngar stod thung ci dag g.yogs pa red/_da dung zhabs phyi zhu gi min zer ga byas/_ha ha ha /_kha snyan po bshad mi dgos/_nga mi gzhan dag gis rgyab bshad brgyab byas _,https://d38pmlk0v88drf.cloudfront.net/wav16k/STT_MV0900_0172_1186246_to_1195623.wav,STT_MV,2,149,9.377,wav16k/STT_MV0900_0172_1186246_to_1195623.wav,ཧ་ཧཧ། རང་ལྟོས་ད། ང་སྟོད་ཐུང་ཞིག་ད་གཡོགས་པ་རེད། ད་དུང་ཞབས་ཕྱི་ཞུ་དགོས་མིན་ཟེར་ག་བྱས། ཧ་ཧ་ཧ། ཁ་སྙན་མོ་བཤད་མི་དགོས། ང་མི་གཞན་དག་གིས་རྒྱབ་བཤད་བརྒྱབ་བྱས།
STT_TT00851_0089_581239_to_587365,བསླབས་བཞག་རྒྱོ་དེ། ཨེ་ནས་ང་ཚོའི་གི་ད་དེའི་གི་རྗེས་སུ་འབྲངས་ནས། ད་སོ་སོས་གིས་འཚོལ་ཐབས་བྱེད་ཀི་ཡོད་རེད་བ།  ,bslabs bzhag rgyo de/_e nas nga tsho'i gi da de'i gi rjes su 'brangs nas/_da so sos gis 'tshol thabs byed ki yod red ba/__,https://d38pmlk0v88drf.cloudfront.net/wav16k/STT_TT00851_0089_581239_to_587365.wav,STT_TT,2,105,6.126,wav16k/STT_TT00851_0089_581239_to_587365.wav,བསླབ་བཞག་རྒྱོ་དེ། ཨེ་ནས། ང་ཚོ་གི་ད་དེི་རྗེས་སུ་འབྲངས་ནས། ད་སོ་སོ་གི་ཚད་ཐབས་བྱེད་ཡོད་རེད་བ།
STT_TT00851_0090_589407_to_592292,བསླབས་བཞག་རྒྱོ་དེ་སྐད་ཆ་དེ་མ་ཡིན་པ། སོ་སོའི་རང་གི་བསམ་བློའི་ཐོག་ནས།  ,bslabs bzhag rgyo de skad cha de ma yin pa/_so so'i rang gi bsam blo'i thog nas/__,https://d38pmlk0v88drf.cloudfront.net/wav16k/STT_TT00851_0090_589407_to_592292.wav,STT_TT,2,69,2.885,wav16k/STT_TT00851_0090_589407_to_592292.wav,བསླབ་བཞག་རྒྱོ་དེ་སྐད་ཆ་དེ་མ་ཡིན་པ། སོ་སོའི་རང་གི་བསམ་བློའི་ཐོག་ནས།
STT_MV0900_0192_1307015_to_1311864,ཡང་ངས་བཤད་སྟངས་ནོར་སོང་ངེ་ཨ།  ,yang ngas bshad stangs nor song nge a/__,https://d38pmlk0v88drf.cloudfront.net/wav16k/STT_MV0900_0192_1307015_to_1311864.wav,STT_MV,2,30,4.849,wav16k/STT_MV0900_0192_1307015_to_1311864.wav,ཡང་ངས་བཤད་སྟངས་ནོར་སོང་ངེ་ཨ།
STT_MV0900_0193_1311864_to_1317213,བློ་མཐུན་ཀན་རྫོས་ཁྲང་། ཨ་འོ།  ,blo mthun kan rdzos khrang /_a 'o/__,https://d38pmlk0v88drf.cloudfront.net/wav16k/STT_MV0900_0193_1311864_to_1317213.wav,STT_MV,2,30,5.349,wav16k/STT_MV0900_0193_1311864_to_1317213.wav,ཧ་ཧཧ། བློ་མཐུན་ཀན་རྫོས་ཁྲང་། ཨའོ།
STT_TT00846_0142_1052727_to_1054954,ནམ་རྒྱུན་ཚིག་བེད་སྤྱོད་བྱས་དུས་དེ་འདྲའི་བྱེད་ཀི་རེད།  ,nam rgyun tshig bed spyod byas dus de 'dra'i byed ki red/__,https://d38pmlk0v88drf.cloudfront.net/wav16k/STT_TT00846_0142_1052727_to_1054954.wav,STT_TT,2,54,2.227,wav16k/STT_TT00846_0142_1052727_to_1054954.wav,ནམ་རྒྱུན་ཚིག་བེད་སྤྱོད་བྱེད་དུས། དེ་འདྲའི་བྱེད་ཀི་རེད།
STT_MV0900_0170_1171456_to_1181442,རང་གིས་ངར་ད་ལྟ་ཤིང་ཅང་གི་ཐུག་པ་ཞིག་བསྐོལ་ན་ང་བློ་ཡིད་ཞེ་དྲག་ཚིམས་པ། སྐྱིད་ཐག་ཆོད་པ་རེད། རང་ལ་ཨོང་བཀུར་ཞུ་ལོན་མེད། ངར་གཡོགས་ད། མའོ་ཀྲུས་ཞིས་ ,rang gis ngar da lta shing cang gi thug pa zhig bskol na nga blo yid zhe drag tshims pa/_skyid thag chod pa red/_rang la ong bkur zhu lon med/_ngar g.yogs da/_ma'o krus zhis _,https://d38pmlk0v88drf.cloudfront.net/wav16k/STT_MV0900_0170_1171456_to_1181442.wav,STT_MV,2,140,9.986,wav16k/STT_MV0900_0170_1171456_to_1181442.wav,རང་གིས་ང་ད་ལྟ་ཤིང་ཅང་གི་ཐུག་པ་ཞིག་བསྐོལ་ན་ང་བློ་ཡིད་ཞེ་དྲག་དུད། དི་ཐག་ཆོད་པ་རེད།  རང་ལ་ཨོང་ྐུར་བཞུགས་ལོང་མེད། ང་གཡོག་ད། མའོ་ཀྲུའུ་ཤིས།
STT_MV0900_0191_1297336_to_1307015,དེ་ལས་འདིར་བཟོས་པ་ཡིན་ན། ཡུལ་མི་ཚོ་ལས་ཐག་བཅད་པ་དང་ལམ་སང་ཁ་ལག་ཚ་སོབ་སོབ་ཅིག་ཟ་ཡ་ཡོད་རེད། དེ་འདྲས་དངོས་གནས།  ,de las 'dir bzos pa yin na/_yul mi tsho las thag bcad pa dang lam sang kha lag tsha sob sob cig za ya yod red/_de 'dras dngos gnas/__,https://d38pmlk0v88drf.cloudfront.net/wav16k/STT_MV0900_0191_1297336_to_1307015.wav,STT_MV,2,107,9.679,wav16k/STT_MV0900_0191_1297336_to_1307015.wav,དེ་ལས་འདིར་བཟོས་པ་ཡིན་ན། ཡུལ་མི་ཚོ་ལས་ཐག་བཅད་པ་ད་ག་ལམ་སང་ཁ་ལག་ཚ་ཚོ་ཚོ་ཟ་ཡ་ཡོད་རེད། དེ་འདྲས་དངོས་གནས།
STT_MV0900_0194_1317213_to_1326185,ངས་རང་ལ་དྲང་པོ་བཤད་དགོས། ང་མ་བྱན་བཅུ་ཤོག་དེའི་བཅུ་དཔོན་བྱེད་ཐུབ་པ་མི་འདུག གང་ཡིན་ཟེར་ན་ང་རྫོང་གྲོང་ལས་ཀ་བྱེད་ཡ་དེ་ཆོག་མཆན་ཐོབ་ཤག བྱས་ཙང་། འབྱོར་ཐོ་བཀོད་ཀར་འགྲོ་མྱི་ཡིན།  ,ngas rang la drang po bshad dgos/_nga ma byan bcu shog de'i bcu dpon byed thub pa mi 'dug_gang yin zer na nga rdzong grong las ka byed ya de chog mchan thob shag_byas tsang /_'byor tho bkod kar 'gro myi yin/__,https://d38pmlk0v88drf.cloudfront.net/wav16k/STT_MV0900_0194_1317213_to_1326185.wav,STT_MV,2,170,8.972,wav16k/STT_MV0900_0194_1317213_to_1326185.wav,ངས་རང་ལ་དྲང་པོ་བཤད་དགོས། ང་མ་བྱན་ཅུ་ཤོག་དེ་བཅུ་སྐྱོན་བྱེད་ཐུབ་པ་མི་འདུག གང་ཡིན་ཟེར་ན། ང་རྫོང་དྲོན་ལས་ཀ་བྱེད་ཡ་དེ་ཆོག་མཆན་ཐོབ་ཤག བྱས་ཙང་འྦྱོར་ཏོ་བསྐོལ་ག་འགྲོ་མྱི་ཡིན།
STT_TT00846_0176_1301802_to_1303995,དེ་གཟུགས་བརྙན་ནང་བཞིན་ཆགས་ཀི་ཡོད་མ་རེད།  ,de gzugs brnyan nang bzhin chags ki yod ma red/__,https://d38pmlk0v88drf.cloudfront.net/wav16k/STT_TT00846_0176_1301802_to_1303995.wav,STT_TT,2,41,2.193,wav16k/STT_TT00846_0176_1301802_to_1303995.wav,དེའི་གཟུགས་བརྙན་ནང་བཞིན་ཆགས་ཀི་ཡོད་མ་རེད།
STT_TT00846_0177_1304296_to_1307432,ད་སྣང་། ཕ་གི་བཙལ་ག་འགྲོ་དུས་ཙ་ནས། རྙེད་ཡ་མི་འདུག་ན།  ,da snang /_pha gi btsal ga 'gro dus tsa nas/_rnyed ya mi 'dug na/__,https://d38pmlk0v88drf.cloudfront.net/wav16k/STT_TT00846_0177_1304296_to_1307432.wav,STT_TT,2,53,3.136,wav16k/STT_TT00846_0177_1304296_to_1307432.wav,ད་སྣང་། ཕ་གི་བཙལ་ག་འགྲོ་དུས་ཙ་ནས།་རྙེད་ཡ་མི་འདུག་ན།
STT_TT00846_0179_1322558_to_1324853,ཁོ་མ་རྙེད་ནས་ཡོད་ཆོག་གི་འདུག་གཱ། གཟུགས་བརྙན་ནང་བཞིན་ཡིན་ན།  ,kho ma rnyed nas yod chog gi 'dug gA/_gzugs brnyan nang bzhin yin na/__,https://d38pmlk0v88drf.cloudfront.net/wav16k/STT_TT00846_0179_1322558_to_1324853.wav,STT_TT,2,60,2.295,wav16k/STT_TT00846_0179_1322558_to_1324853.wav,ཁོ་མ་རྙེད་ནས་ཡོད་ཆོག་གི་འདུག་ག། གཟུགས་བརྙན་ནང་བཞིན་ཡིན་ན།
STT_MV0900_0206_1398661_to_1404929,དེར་དུས་ཚོོད་འཕྲོ་བརླག་ཕྱིན་པ་ཟེར་གི་རེད་བེ་ཨ།  ,der dus tsho+od 'phro brlag phyin pa zer gi red be a/__,https://d38pmlk0v88drf.cloudfront.net/wav16k/STT_MV0900_0206_1398661_to_1404929.wav,STT_MV,2,48,6.268,wav16k/STT_MV0900_0206_1398661_to_1404929.wav,འདིར་དུས་ཚོད་འཕྲོ་བརླག་ཕྱིན་པ་ཟེར་གི་རེད་པེ་ཨ།
STT_MV0900_0214_1461775_to_1466227,མར་དོན་ཤོག་ད། གོ་བྱུང་ངེ།  ,mar don shog da/_go byung nge/__,https://d38pmlk0v88drf.cloudfront.net/wav16k/STT_MV0900_0214_1461775_to_1466227.wav,STT_MV,2,27,4.452,wav16k/STT_MV0900_0214_1461775_to_1466227.wav,མར་དོན་ཤོག་ད། གོ་བྱུང་ངེ་།
STT_MV0900_0223_1527046_to_1537045,ཨ་མ་རང་ཉོན་ཨ། སློབ་ཚན་འཚོགས། སློབ་ཚན་གྲོལ། སྦྱོང་ཚན་བྲིས། སྦྱོང་ཚན་བསྐྱལ། འཁྲིས་ལ་ནི་དེབ་ནང་མགོ་བརྒྱུད་བསྡད་མྱི་རྐྱང་རེད། ཆོ་ག་རེ་ཡོད་རེད་། སློབ་སྦྱོང་མ་བྱས་ན།  ,a ma rang nyon a/_slob tshan 'tshogs/_slob tshan grol/_sbyong tshan bris/_sbyong tshan bskyal/_'khris la ni deb nang mgo brgyud bsdad myi rkyang red/_cho ga re yod red /_slob sbyong ma byas na/__,https://d38pmlk0v88drf.cloudfront.net/wav16k/STT_MV0900_0223_1527046_to_1537045.wav,STT_MV,2,161,9.999,wav16k/STT_MV0900_0223_1527046_to_1537045.wav,ཨ་མ་རང་ཉོན་ཨ། སློབ་ཚན་ཚོ་སློབ་ཚན་གྲོལ། སྦྱོང་ཚན་ཁྲིད། སྦྱོང་ཚན་ྒས། ཁྲིད་ལ་དེ་དེབ་ནང་སྒོ་བརྒྱུད་བསྡད་མྱི་རྐྱང་རེད། ཆོ་ག་རེ་ཡོད་རེད། སློབ་སྦྱོང་མ་བྱས་ན།
STT_MV0900_0184_1258018_to_1267802,ང་རྒྱུས་མངའ་ཆེ་ཤོས་དེ་རང་རེད་ཤག བཞག་རོགས་གྱིས། ངར་ཁ་སྙན་པོ་བཤད་མི་དགོས། ལོ་དེ་གས་ནང་ལ་དོན་དག་ག་འདྲས་གཅིག་ཐད་ལ་ངས་རང་གི་རྐང་པ་འཐེན་མྱོང་ཡོད།  ,nga rgyus mnga' che shos de rang red shag_bzhag rogs gyis/_ngar kha snyan po bshad mi dgos/_lo de gas nang la don dag ga 'dras gcig thad la ngas rang gi rkang pa 'then myong yod/__,https://d38pmlk0v88drf.cloudfront.net/wav16k/STT_MV0900_0184_1258018_to_1267802.wav,STT_MV,2,141,9.784,wav16k/STT_MV0900_0184_1258018_to_1267802.wav,ང་རྒྱུས་མངའ་ཆེ་ཤོས་དེ་རང་རེད་ཤག ཞབས་རོགས་བྱིས། ངར་ཁ་སྙན་པ་བཤད་མི་དགོས། ལོ་འདི་གས་ནང་ལ་དོན་དག་ག་འདྲས་གཅིག་གི་ཐད་ལ་ ངས་རང་ལ་རྐང་པ་འཐེན་མྱོང་ཡོད།
STT_TT00846_0192_1419013_to_1421317,དགྲ་དེའི་མིང་དེ་བརྗོད་ས་གི་གཞི། བརྗོད་བྱའི་དོན།  ,dgra de'i ming de brjod sa gi gzhi/_brjod bya'i don/__,https://d38pmlk0v88drf.cloudfront.net/wav16k/STT_TT00846_0192_1419013_to_1421317.wav,STT_TT,2,49,2.304,wav16k/STT_TT00846_0192_1419013_to_1421317.wav,དྒྲ་དེ་མིང་དེ་བརྗོད་ས་གི་གཞི་བརྗོད་བྱའི་དོན།
STT_MV0900_0186_1270982_to_1279072,རང་དངོས་གནས་བློ་མཐུན་བཟང་པོ་གཅིག་རེད་ཤག འགྱུར་མེད་གྲལ་རིམ་གི་གསར་བརྗེའི་འཐབ་འཛིང་པ། སོ་སོ་བློས་གཏོང་བྱས་ནས་ཚང་མར་བསམ་བློ་གཏོང་མྱི་གི་ཏང་ཡོན་བཟང་པོ་གཅིག་རེད་ཞག ,rang dngos gnas blo mthun bzang po gcig red shag_'gyur med gral rim gi gsar brje'i 'thab 'dzing pa/_so so blos gtong byas nas tshang mar bsam blo gtong myi gi tang yon bzang po gcig red zhag_,https://d38pmlk0v88drf.cloudfront.net/wav16k/STT_MV0900_0186_1270982_to_1279072.wav,STT_MV,2,159,8.09,wav16k/STT_MV0900_0186_1270982_to_1279072.wav,རང་དངོས་གནས་བློ་མཐུན་བཟང་པོ་གཅིག་རེད་ཤག འབྱོར་མས་གྲལ་རིམ་གི་གསར་བརྗེའི་འཐབ་འཛིན་པ། སོ་སོ་བློས་གཏོང་བྱས་ནས་ཚང་མར་བསམ་བློ་གཏང་མྱི་གི་ཏང་ཡོན་བཟང་པོ་གཅིག་རེད་ཤག
STT_TT00846_0201_1475665_to_1478382,ཨེ་ནས། དེ་འདྲའི་དེ་ཨེ་ནས་འཆར་ཡོང་བའི་སྐབས་ལ།  ,e nas/_de 'dra'i de e nas 'char yong ba'i skabs la/__,https://d38pmlk0v88drf.cloudfront.net/wav16k/STT_TT00846_0201_1475665_to_1478382.wav,STT_TT,2,46,2.717,wav16k/STT_TT00846_0201_1475665_to_1478382.wav,ཨེ་ནས། དེ་འདྲའི་དེ། ཨེ་ནས་འཆར་ཡོང་པའི་སྐབས་ལ།
STT_TT00846_0202_1481250_to_1487697,དངོས་པོའི་གནས་ཚུལ་ལ་ཡོད་པ། རང་དབང་དུ་ཡོད་པ་དེ་འདྲའི་འཆར་གི་འདུག་མི་འདུག རེད་བ། ཨོ་དེ་ལྟ་ཡ་བྱས།  ,dngos po'i gnas tshul la yod pa/_rang dbang du yod pa de 'dra'i 'char gi 'dug mi 'dug_red ba/_o de lta ya byas/__,https://d38pmlk0v88drf.cloudfront.net/wav16k/STT_TT00846_0202_1481250_to_1487697.wav,STT_TT,2,96,6.447,wav16k/STT_TT00846_0202_1481250_to_1487697.wav,ཨེདངོས་པོའི་གནས་ཚུལ་ལ་ཡོད་པ། རང་དབང་དུ་ཡོད་པ། དེ་འདྲའི་འཆར་གི་འདུག་མི་འདུག རེད་བ། ཨོ་དེ་ལྟ་ཡ་བྱས།
STT_TT00846_0205_1500501_to_1503509,ད་ནམ་རྒྱུན་འཇིག་རྟེན་ནང་ལ་དེ་དྲི་བ་དེ་གཏང་ཡ་ལུགས་སྲོལ་ཁོ་རང་ཡོད་མ་རེད་བ་ད།  ,da nam rgyun 'jig rten nang la de dri ba de gtang ya lugs srol kho rang yod ma red ba da/__,https://d38pmlk0v88drf.cloudfront.net/wav16k/STT_TT00846_0205_1500501_to_1503509.wav,STT_TT,2,76,3.008,wav16k/STT_TT00846_0205_1500501_to_1503509.wav,ད་ནམ་རྒྱུན་འཇིག་རྟེན་ནང་ལ་ དེ་དྲི་བ་གཏང་ཡ་ལུགས་སྲོལ་ཁོ་རང་ཡོད་མ་རེད་བ་ད།
STT_TT00851_0091_592664_to_599414,ནང་ལོགས་ནས། ཨེ་ནས་མེད་ཐག་ཆོད་རེད་བསམ་པའི་ཨེ་ནས་བསམ་བློ་དེ་སླེབས་ཡོང་དུས། དེ་འདྲའི་དེ་གིས་ཨེ་ནས་གཞི་ནས་ཕན་ཡ་མགོ་དངོས་གནས་དེ་དེ་ནས་བཙུགས་འགྲོ་གི་འདུག་བ།  ,nang logs nas/_e nas med thag chod red bsam pa'i e nas bsam blo de slebs yong dus/_de 'dra'i de gis e nas gzhi nas phan ya mgo dngos gnas de de nas btsugs 'gro gi 'dug ba/__,https://d38pmlk0v88drf.cloudfront.net/wav16k/STT_TT00851_0091_592664_to_599414.wav,STT_TT,2,152,6.75,wav16k/STT_TT00851_0091_592664_to_599414.wav,ནང་ལོགས་ནས། ཨེ་ནས་མེད་ཐག་ཆོད་རེད་བསམ་པའི་ཨེ་ནས། བསམ་བློ་དེ་སླེབས་ཡོང་དུས། དེ་འདྲའི་དེ་གི་ཨེ་ནས་གཞི་ནས་ཕན་ཡ་འགོ་དངོས་གནས་དེ་དེ་འནྲའི་བཙུགས་འགྲོ་གི་རེད་བ།
STT_TT00846_0208_1512300_to_1517312,ཨེ་ནས། དང་པོ་འདྲ་ཆགས་པོ་ག་འདྲིའི་ཅིག་ཡོད་ནས། དེ་ལ། ཨེ་ནས། ཞིབ་ཚགས་པོ་བྱས་ནས་ཞིབ་འཇུག་བྱས་ན། ཨེ་ནས་སྡུག་རུ་སྡུག་རུ་སྡུག་རུ།  ,e nas/_dang po 'dra chags po ga 'dri'i cig yod nas/_de la/_e nas/_zhib tshags po byas nas zhib 'jug byas na/_e nas sdug ru sdug ru sdug ru/__,https://d38pmlk0v88drf.cloudfront.net/wav16k/STT_TT00846_0208_1512300_to_1517312.wav,STT_TT,2,124,5.012,wav16k/STT_TT00846_0208_1512300_to_1517312.wav,ཨེ་ནས། དང་པོ་འདྲ་ཆགས་པོ་ག་འདྲའི་ཅིག་ཡོད་ནས། དེ་ལ་ཨེ་ནསཞིབ་ཚགས་པོ་བྱས་ནས་ཞིབ་འཇུག་བྱས་ན། ཨེ་ནས་ སྡུག་རུ་སྡུག་རུ་སྡུ་རུ།
STT_TT00846_0125_923699_to_926931,དཔེ་ཆ་མང་པོ་ཅིག་ནང་ལོགས་ལ་ཡིད་ལུགས་ཟེར་ནས་ཡོད་རེད། ཡིད་ལུགས་སུ་མ་གྲུབ་ཟེ།  ,dpe cha mang po cig nang logs la yid lugs zer nas yod red/_yid lugs su ma grub ze/__,https://d38pmlk0v88drf.cloudfront.net/wav16k/STT_TT00846_0125_923699_to_926931.wav,STT_TT,2,75,3.232,wav16k/STT_TT00846_0125_923699_to_926931.wav,དཔེ་ཆ་མང་པོ་ཅིག་ནང་ལོགས་ལ་ཡིད་ལུགས་ཟེར་ནས་ཡོད་རེད། ཡིན་ལུགས་སུ་མ་གྲུབ་ཟེ།
STT_TT00846_0127_939347_to_947283,བྱས་ཙང་སྡོད་ལུགས་ཟེར་དུས། ཨེ་ནས་སྡོད་ཟེར་ཡ་དེ་ད་གནས་ཟེར་ཡ་དེ་གཅིག་པ་རེད་བ། ལུགས་ཟེར་ཡ་དེ་ཚུལ་ཟེར་ཡ་དེ་གཅིག་པ་རེད་བ། དེ་བྱེད་དུས་སྡོད་ལུགས།  ,byas tsang sdod lugs zer dus/_e nas sdod zer ya de da gnas zer ya de gcig pa red ba/_lugs zer ya de tshul zer ya de gcig pa red ba/_de byed dus sdod lugs/__,https://d38pmlk0v88drf.cloudfront.net/wav16k/STT_TT00846_0127_939347_to_947283.wav,STT_TT,2,140,7.936,wav16k/STT_TT00846_0127_939347_to_947283.wav,བྱས་ཙང་། སྡོད་ལུགས་ཟེར་དུས། ཨེ་ནས། སྡོད་ཟེར་ཡ་དེ་ད་གནས་ཟེར་ཡ་དེ་གཅིག་པ་རེད་བ། ལུགས་ཟེར་ཡ་དེ་ཚུལ་ཟེར་ཡ་དེ་གཅིག་པ་རེད་བ། དེ་བྱས་དུས་ སྡོད་ལུགས།
STT_MV0900_0207_1404929_to_1412219,ལོ་དེ་གས་ནང་ལ་ངེད་གཉིས་ཅང་ཤིས་ལ་ཡོང་།  ,lo de gas nang la nged gnyis cang shis la yong /__,https://d38pmlk0v88drf.cloudfront.net/wav16k/STT_MV0900_0207_1404929_to_1412219.wav,STT_MV,2,39,7.29,wav16k/STT_MV0900_0207_1404929_to_1412219.wav,ལོ་འདི་གས་ནང་ལ་ང་གཉིས་ཅང་ཤིང་ལ་ཡོང་།
STT_MV0900_0210_1424028_to_1426963,རང་གིས་གནས་ལུགས་རྒྱུ་མཚན་མ་བཤད་ན་ང་ལས་གེ་བཤད་ཡ་མེད་ ,rang gis gnas lugs rgyu mtshan ma bshad na nga las ge bshad ya med _,https://d38pmlk0v88drf.cloudfront.net/wav16k/STT_MV0900_0210_1424028_to_1426963.wav,STT_MV,2,52,2.935,wav16k/STT_MV0900_0210_1424028_to_1426963.wav,རང་གིས་གནས་ལུགས་རྒྱུ་མཚན་མ་བཤད་ན། ང་ལས་གེ་བཤད་ཀི་མེད།
