file_name,uni,wylie,url,dept,grade,char_len,audio_len,path,inf
STT_MV0658_0358_2244792_to_2253233,ཡང་སྣ་ཁུང་བརྡབ་འདུག་ག བཤད་སྟངས་ཏག་ཏག་བསྡད་ཡོད་རེད། ཨ་ཁུ། བཤད་སྟངས་ཏགཏག་མ་བསྡད་པ་ག་འདྲས་སེ། འདི་ཡང་ང་མ་ཉེས་ཁ་གཡོགས་བྱས་བྱུང་ང ,yang sna khung brdab 'dug ga_bshad stangs tag tag bsdad yod red/_a khu/_bshad stangs tagatag ma bsdad pa ga 'dras se/_'di yang nga ma nyes kha g.yogs byas byung nga_,https://d38pmlk0v88drf.cloudfront.net/wav16k/STT_MV0658_0358_2244792_to_2253233.wav,STT_MV,2,125,8.441,wav16k/STT_MV0658_0358_2244792_to_2253233.wav,ཨུ། ཡང་སྣ་ཁུག་རྡབས་འདུག་ག བཤད་སྟངས་ཏག་ཏག་བསྡད་ཡོད་མ་རེད། ཨ་ཁུ། བཤད་སྟངས་ཏག་ཏག་མ་བསྡད་པ་ག་འདརས་སེ། དེ་ཡང་ང་མ་ཉེས་ཁང་ཡོགས་བྱས་བྱུང་ང
STT_MV0658_0379_2388444_to_2394389,ཉལ་ཁང་རྙིང་པའི་ནང་ཕར་སྤོ་དགོས་མེད་འགྲོ དངམ་སྐྲག་འདི་འདྲས་བྱེད་ཡ་ག་རེ་འདུག དངམ་སྐྲག་མ་བྱེད་ཨེ། ལོ་ཉི་ཤུ་སེ་འགྲོ་གིན ,nyal khang rnying pa'i nang phar spo dgos med 'gro_dngam skrag 'di 'dras byed ya ga re 'dug_dngam skrag ma byed e/_lo nyi shu se 'gro gin_,https://d38pmlk0v88drf.cloudfront.net/wav16k/STT_MV0658_0379_2388444_to_2394389.wav,STT_MV,2,115,5.945,wav16k/STT_MV0658_0379_2388444_to_2394389.wav,ངས་ཁང་པ་ཉི་མིན་ན་ཕང་སྤོ་གོ་མིན་འགྲོ དངང་སྐྲག་འདི་འདྲས་བྱེད་ཡ་ག་རེ་འདུག དངང་སྐྲག་མ་བྱེད་ཨ། ལོ་ཉི་ཤུ་རྩ་འགྲོ་གི་ཡིན
STT_MV0658_0364_2282967_to_2289438,མོ་རང་གིས་མོས་མཐུན་བྱེད་ཀི་མ་རེད། ཡིན་ནས། ངེད་གཉིས་ཚེ་སྔོན་སྐོར་བཤད་པས་མ་གཏོགས་པུ་གུའི་སྐོར་བཤད་མེད། བྱས་ན་རང་ཨུ་ཚུགས་ཚ་དྲགས་པ་རེད ,mo rang gis mos mthun byed ki ma red/_yin nas/_nged gnyis tshe sngon skor bshad pas ma gtogs pu gu'i skor bshad med/_byas na rang u tshugs tsha drags pa red_,https://d38pmlk0v88drf.cloudfront.net/wav16k/STT_MV0658_0364_2282967_to_2289438.wav,STT_MV,2,131,6.471,wav16k/STT_MV0658_0364_2282967_to_2289438.wav,མོ་རང་གིས་མོས་མཐུན་བྱེད་དགོས་མ་རེད། ཡིན་ནས་ངེད་གཉིས་མཚན་མའི་སྐོར་བཤད་པ་མ་གཏོགས་ པུ་གུའི་སྐོར་བཤད་མེད། བྱས་ན་རང་ཨུ་ཚུགས་ཚ་དྲག་པ་རེད
STT_MV0658_0378_2379871_to_2388444,ག་རེ་བྱས་སོང། ངའི་བསམ་པ་ང་རང་གཉིས་ཆང་ས་བརྒྱབ་པ་ཡིན་ན ,ga re byas song/_nga'i bsam pa nga rang gnyis chang sa brgyab pa yin na_,https://d38pmlk0v88drf.cloudfront.net/wav16k/STT_MV0658_0378_2379871_to_2388444.wav,STT_MV,2,53,8.573,wav16k/STT_MV0658_0378_2379871_to_2388444.wav,ག་རེ་བྱས་སོང་། ངའི་བསམ་པ་ང་རང་གཉིས་ཆང་ས་བརྒྱབ་པ་ཡིན་ན
STT_MV0658_0380_2394389_to_2401246,ད་དུང་སྒུག་པ་ཡིན་ན། ང་ཨ་ཡུ་མགོ་དཀར་ཆགས་པ། ངས་བྱས་ན་དོན་དག་འདི་ཡོན་ཧྤིན་དང་ཧྤང་གིས ,da dung sgug pa yin na/_nga a yu mgo dkar chags pa/_ngas byas na don dag 'di yon h+pin dang h+pang gis_,https://d38pmlk0v88drf.cloudfront.net/wav16k/STT_MV0658_0380_2394389_to_2401246.wav,STT_MV,2,82,6.857,wav16k/STT_MV0658_0380_2394389_to_2401246.wav,ད་དུང་བསྒུག་པ་ཡིན་ན། ང་ཨ་ཡེན་དགོས་ཐ་བཞག་པ། ངས་བྱས་ན་དོན་དག་དེ། ལེན་ཧྤིན་དང་ཧྥང་གིས
STT_MV0658_0382_2406596_to_2410709,གང་ལྟར་དོན་དག་འདི། རང་གིས་སྔོན་ལ་ལབ་ན་ད་ག་རེད་པ། རང་དགའ་བ་སྔ་མ་དྲགས་ཨ ,gang ltar don dag 'di/_rang gis sngon la lab na da ga red pa/_rang dga' ba snga ma drags a_,https://d38pmlk0v88drf.cloudfront.net/wav16k/STT_MV0658_0382_2406596_to_2410709.wav,STT_MV,2,70,4.113,wav16k/STT_MV0658_0382_2406596_to_2410709.wav,གང་ལྟར་དོན་དག་འདི་རང་གིས་མན་མ་ལང་ན་ག་རེ་བྱེད་ཀ རང་དགའ་བ་སྔ་མ་དྲགས་ཨ
STT_MV0658_0384_2418972_to_2427315,ཡུན་རིང་ལོད་སྒུག་དགོས་རེད། ལོ་བཅུ་རེད། ཡང་ན། ཉི་ཤུ་རེད་ཨ། ལོ་བརྒྱ་སྒུག ལོ་བརྒྱ་སྒུག་ཟེར། ཤི་ཤི་བར་དུ་སྒུག་བཅུག་ན་ད་ག་རེད། ཧེ་ཧེ་ཧེ་ཧེ ,yun ring lod sgug dgos red/_lo bcu red/_yang na/_nyi shu red a/_lo brgya sgug_lo brgya sgug zer/_shi shi bar du sgug bcug na da ga red/_he he he he_,https://d38pmlk0v88drf.cloudfront.net/wav16k/STT_MV0658_0384_2418972_to_2427315.wav,STT_MV,2,134,8.343,wav16k/STT_MV0658_0384_2418972_to_2427315.wav,རྒྱུ་རང་དོ་ཡུག་དགོས་རེད། ལོ་བཅུ་ལས་ཡང་ཉི་ཤུ་རེད་ཨ། ལོ་བརྒྱ་དུག། ལོ་བརྒྱ་སདུས་ཟེར། ཕྱི་ཅིག་བར་དུ་ཁུང་བྱུག་ན་ད་ག་རེད། ཧ་ཧ་ཧ་ཧཧཧཧ
STT_MV0658_0387_2441372_to_2445902,རྨའེ་ཚང་ལ་སྤོ་གི་ཡིན་ཟེར། མག་པ་འགྲོ་མྱི་ཡིན་པེ། ཡོན་ཧྤིན ,rma'e tshang la spo gi yin zer/_mag pa 'gro myi yin pe/_yon h+pin_,https://d38pmlk0v88drf.cloudfront.net/wav16k/STT_MV0658_0387_2441372_to_2445902.wav,STT_MV,2,57,4.53,wav16k/STT_MV0658_0387_2441372_to_2445902.wav,རྨའེ་ཚང་ལ་བུ་གུ་ཡིན་ཟེར། མག་པ་འགྲོ་མྱི་ཡིན་པེ། ཡོན་ཧྤིན
STT_MV0658_0390_2454336_to_2455838,འདི་ཨ་མ་ཁྱེད་གཉིས་ཁང་པ་རེད་ད ,'di a ma khyed gnyis khang pa red da_,https://d38pmlk0v88drf.cloudfront.net/wav16k/STT_MV0658_0390_2454336_to_2455838.wav,STT_MV,2,29,1.502,wav16k/STT_MV0658_0390_2454336_to_2455838.wav,འདི་ཨ་མ་ཁྱེད་གཉིས་ཀི་ཁང་པ་རེད་ད
STT_MV0717_0201_1378878_to_1388629,རེད་མ་རེད། ཁྱོ་ག་ཟེར་མྱི་དེ་དངོས་གནས་ལས་སླ་པོ་མ་རེད་ད། རང་ང་མགོ་སྐོར་གཏང་ཡ་བཞག་ཤིག རང་ག་རེ་ཟ། འདི་ཨོ། འདུམ་སྒྲིལ་རྒྱག་གི་ཡོད་མ་རེད་བ། མི་དེ་འདྲའི་ལ་ཡིད་ཆེས་མེད། ཨ་ཙི།  ,red ma red/_khyo ga zer myi de dngos gnas las sla po ma red da/_rang nga mgo skor gtang ya bzhag shig_rang ga re za/_'di o/_'dum sgril rgyag gi yod ma red ba/_mi de 'dra'i la yid ches med/_a tsi/__,https://d38pmlk0v88drf.cloudfront.net/wav16k/STT_MV0717_0201_1378878_to_1388629.wav,STT_MV,2,168,9.751,wav16k/STT_MV0717_0201_1378878_to_1388629.wav,རེད་མ་རེད། ཁྱོ་ག་ཟེར་མྱི་དེ་དངོས་གནས་ལས་སླ་པོ་མ་རེད་ད། རང་ང་མགོ་སྐོར་གཏང་ཡ་ཞོག་ཤིག རང་ག་རེ་ཟེ། འདི་སྡུམ་རྲིས་རྒྱལ་བོང་མ་རེད་པ། ང་མི་འདེ་འདྲས་ལ་ཡིད་ཆེས་རེད་། ཨ
STT_TT00847_0132_861668_to_867017,ཡོད་མེད་ཧ་མ་གོ་ན། བདག་མ་ཡིན་པ་གསལ་པོ་ཞེ་པུ་ཆགས་རེད། ག་རེ་རེད་ཟེར་ན། ང་ཡོད་མེད་དོགས་པ་འདུག་བེ།  ,yod med ha ma go na/_bdag ma yin pa gsal po zhe pu chags red/_ga re red zer na/_nga yod med dogs pa 'dug be/__,https://d38pmlk0v88drf.cloudfront.net/wav16k/STT_TT00847_0132_861668_to_867017.wav,STT_TT,2,95,5.349,wav16k/STT_TT00847_0132_861668_to_867017.wav,ཡོད་མེད་ཧ་མ་གོ་ན། བདག་མ་ཡིན་པ་གསལ་པོ་ཞེ་བོ་ཆགས་རེད། ག་རེ་རེད་ཟེར་ན། ང་ཡོད་མེད་དོགས་པ་འདུག་བེ།
STT_AB00635_0057_330981_to_333148,སོགས་ཀྱིས་བྲག་ཆ་དང་ ,sogs kyis brag cha dang _,https://d38pmlk0v88drf.cloudfront.net/wav16k/STT_AB00635_0057_330981_to_333148.wav,STT_AB,2,20,2.167,wav16k/STT_AB00635_0057_330981_to_333148.wav,སོགས་ཀྱི་བྲག་ཆ་དང་
STT_MV0658_0381_2401246_to_2406596,མོས་མཐུན་བྱས་སོང་ན། གཏན་ཁེལ་བྱེད་གཏོང་། རེད། ཪེད། རང་སེམས་ཁྲལ་མ་བྱེད་ཨ། ངས་ཤེས་སོང། ད་ངས་གསལ་བོ་ཤེས་སོང ,mos mthun byas song na/_gtan khel byed gtong /_red/_Red/_rang sems khral ma byed a/_ngas shes song/_da ngas gsal bo shes song_,https://d38pmlk0v88drf.cloudfront.net/wav16k/STT_MV0658_0381_2401246_to_2406596.wav,STT_MV,2,104,5.35,wav16k/STT_MV0658_0381_2401246_to_2406596.wav,མོས་མཐུན་ཆག་ཟིན་གཏན་ཁེལ་ཆེད་དོ། རེད་རེད།རེད། རང་སེམས་ཁྲལ་མ་བྱེད་ཨ། ངས་ཤེས་སོང་། ད་ཉིན་གསལ་པོ་བྱས་སོང་།
STT_MV0658_0383_2410709_to_2418972,ངས་བྱས་ན། ཕར་སེ་སྒུག་ན་བསམ་གི ཨ་ཙི། ད། ངས་ད་གིན་ནས་བཤད་པ་ཡིན། ད་དུང་ང་སྒུག་རུ་བཅུག་མྱི་ཡིན་པེ་ཨ ,ngas byas na/_phar se sgug na bsam gi_a tsi/_da/_ngas da gin nas bshad pa yin/_da dung nga sgug ru bcug myi yin pe a_,https://d38pmlk0v88drf.cloudfront.net/wav16k/STT_MV0658_0383_2410709_to_2418972.wav,STT_MV,2,96,8.263,wav16k/STT_MV0658_0383_2410709_to_2418972.wav,ངས་བྱས་ན། ཕ་ཙི་སྒུག་ན་བསམ་གིས། ཨ་ཙི། ད་ནས་བཤད་པ་ཡིན་ན། ད་དུང་ང་སྒུག་རུ་བཅུག་མྱི་ཡོད་པེ་ཨ།
STT_MV0658_0388_2445902_to_2453043,འདི་མག་པ་ཕྱིན་མ་ཕྱིན་གི་གནས་ཚུལ་མ་རེད། ཨ་ཅག་རྨའེ་ཤང་ཁང་པ་རྙིང་པ་ནས་ཁ་བྲལ་འདོད་ཡོད་མ་རེད། ཁ་བྲལ་འདོད་མེད་ན། པ་པ་རང་ཕར་སྤོ་དགོས་རེད་པེ ,'di mag pa phyin ma phyin gi gnas tshul ma red/_a cag rma'e shang khang pa rnying pa nas kha bral 'dod yod ma red/_kha bral 'dod med na/_pa pa rang phar spo dgos red pe_,https://d38pmlk0v88drf.cloudfront.net/wav16k/STT_MV0658_0388_2445902_to_2453043.wav,STT_MV,2,133,7.141,wav16k/STT_MV0658_0388_2445902_to_2453043.wav,དི་མག་པ་ཕྱིན་མ་ཕྱིན་ཀི་གནས་ཚུལ་མ་རེད། ཨ་ཅག་རྨའེ་ཤང་ཁང་པ་རྙིང་པ་ནས་ཁ་བྲལ་འདོད་ཡོད་མ་རེད། ཁ་བྲལ་འདོད་མེད་ན། པ་ཕ་རང་ཕར་སྤོར་དགོས་རེད་པེ
STT_MV0660_0002_53075_to_58860,རང་ཆུའི་ནང་ག་དུས་འཛུལ་པ་ཨ། ཨ་ཧ། འདི་ངས་རང་ཤེས་བཅུག་ན་ཡོང་གི་རེད་པེ་ཨ། ཧེ་ཧེ། རང་ནི་འདི་འདྲས་ལྐུགས་ཀ་ལ ,rang chu'i nang ga dus 'dzul pa a/_a ha/_'di ngas rang shes bcug na yong gi red pe a/_he he/_rang ni 'di 'dras lkugs ka la_,https://d38pmlk0v88drf.cloudfront.net/wav16k/STT_MV0660_0002_53075_to_58860.wav,STT_MV,2,102,5.785,wav16k/STT_MV0660_0002_53075_to_58860.wav,རང་ཆུའི་ནང་ག་དུས་འཛུལ་པ། འདི་ངས་རང་བཤད་བཅུག་ན་ཡོང་གི་རེད་པེ་ཨ། ཧཧ་ཧ། རང་དེ་འདྲས་ལྐུགས་པ་ལ
STT_MV0660_0004_64410_to_69743,ཡ་ཡག་པོ་གཅིག་སྡོམས་ལགས། འེན། ད་ཤོར་བཅུག་ན་ཡོང་གི་མ་རེད་གདའ།  ,ya yag po gcig sdoms lags/_'en/_da shor bcug na yong gi ma red gda'/__,https://d38pmlk0v88drf.cloudfront.net/wav16k/STT_MV0660_0004_64410_to_69743.wav,STT_MV,2,61,5.333,wav16k/STT_MV0660_0004_64410_to_69743.wav,ཡ་ཡག་པོ་བྱས་སྡོམ་པ་ལག། ད་ཤོར་བཅུག་ན་ཡོང་གི་མ་རེད་གད།
STT_MV0660_0005_69743_to_76266,ཤང་ཨར། འུ། ལག་པ་ནས་ཤོར་བྱས། རང་འཇགས་ཚུར་རག་པའི་ཚོར་སྣང་དེ་ག་འདྲས་འདུག་ཨ ,shang ar/_'u/_lag pa nas shor byas/_rang 'jags tshur rag pa'i tshor snang de ga 'dras 'dug a_,https://d38pmlk0v88drf.cloudfront.net/wav16k/STT_MV0660_0005_69743_to_76266.wav,STT_MV,2,72,6.523,wav16k/STT_MV0660_0005_69743_to_76266.wav,ཨཤང་ཨར། ཨུ། ལག་པ་ནས་ཤོར་བྱས་རང་འཇག་ཚུར་རག་པའི་ཚོར་སྣང་འདེ་ག་འདྲས་འདུག་ཨ
STT_MV0660_0014_136252_to_141249,ཧུ། ལོག་ཡོང་པེ། ང་ནི་ཞེ་བོ་གཅིག་ཞེད་བྱུང། ཆར་རྡུང་བཟེད་བྱུང་ངེ། མགྱོགས་པོ་ཤོག་དང་།  ,hu/_log yong pe/_nga ni zhe bo gcig zhed byung/_char rdung bzed byung nge/_mgyogs po shog dang /__,https://d38pmlk0v88drf.cloudfront.net/wav16k/STT_MV0660_0014_136252_to_141249.wav,STT_MV,2,84,4.997,wav16k/STT_MV0660_0014_136252_to_141249.wav,ལོག་ཡོང་པེ། ང་ནི་ཞེ་བོ་ཅིག་ཞེད་བྱུང་། ཆབ་རྡུག་བཟེད་བྱུང་ངེ། མགྱོགས་པོ་ཤོག་ད
STT_MV0048_0012_65212_to_74600,ཨ་ལས་དེ་འདྲས་ཡིན་པ་རེད། བྱས་ཙང་བྱས། དངོས་གནས་གླ་རྩི་ལས་ད་དྲི་མ་ཞེ་དྲག་ཞིམ་པ་འདུག་ག ཞུས་ཙང་བྱས། འོམ། འདྲ་ས་མི་འདུག གླ་རྩི་ཞིག་ད་ཕར་བཞག་རེད་ཤག ཅ་ལག་དཔེ་གསར་དེ་ ,a las de 'dras yin pa red/_byas tsang byas/_dngos gnas gla rtsi las da dri ma zhe drag zhim pa 'dug ga_zhus tsang byas/_'om/_'dra sa mi 'dug_gla rtsi zhig da phar bzhag red shag_ca lag dpe gsar de _,https://d38pmlk0v88drf.cloudfront.net/wav16k/STT_MV0048_0012_65212_to_74600.wav,STT_MV,2,158,9.388,wav16k/STT_MV0048_0012_65212_to_74600.wav,ཨ་ལེ།ང་ཐེབ་ཡིན་པ་རེད།བྱས་ཙང་ དངོས་གནས་་ས་ྱས་་ྲི་མོ་ཞེ་གྲང་གིས་ཞིམ་པོ་འདུག་ག་སད་མི་འདུག  ལད་ས་མི་འདུག ལ་སེ། ་རེ་ེ་ག་དཔོེ་གསར་འདི།
STT_MV0048_0013_74600_to_77819,ག་རེ་གནང་ཡ་རེད་ལགས། འདི་ལགས ,ga re gnang ya red lags/_'di lags_,https://d38pmlk0v88drf.cloudfront.net/wav16k/STT_MV0048_0013_74600_to_77819.wav,STT_MV,2,28,3.219,wav16k/STT_MV0048_0013_74600_to_77819.wav,ག་རེ་གནང་ཡ་རེད་ལག། འདི་ལ།
STT_MV0660_0003_58860_to_64410,གྲུ་ཡག་པོ་གཅིག་བསྡམས་ཐུབ་མི་འདུག ཨ་ཧ། ཨ་ཧ།  ,gru yag po gcig bsdams thub mi 'dug_a ha/_a ha/__,https://d38pmlk0v88drf.cloudfront.net/wav16k/STT_MV0660_0003_58860_to_64410.wav,STT_MV,2,44,5.55,wav16k/STT_MV0660_0003_58860_to_64410.wav,གྲུ་ཡག་པོ་གྱིག་གདམ་ཐུབ་མི་འདུག ཧཧ
STT_AB00236_0201_1711646_to_1713558,ཁོང་ཁྲོ་ཟ་ནས་བྱེད་ཐབས་མེད་པའི་ངང་ནས་ལོག ,khong khro za nas byed thabs med pa'i ngang nas log_,https://d38pmlk0v88drf.cloudfront.net/wav16k/STT_AB00236_0201_1711646_to_1713558.wav,STT_AB,2,40,1.912,wav16k/STT_AB00236_0201_1711646_to_1713558.wav,ཁོང་ཁྲོ་ཟ་ནས་བྱེད་ཐབས་མེད་པའི་ངང་ནས་ལོག
STT_MV0660_0006_76266_to_81068,ཧེ་ཧེ་ཧེ། ཨ་ཙི། ངས་རང་འདྲི་གི་མི་འདུག་གེ རང་ལྟོས་ད། རློན་རྐྱང་རེད་ཤག ,he he he/_a tsi/_ngas rang 'dri gi mi 'dug ge_rang ltos da/_rlon rkyang red shag_,https://d38pmlk0v88drf.cloudfront.net/wav16k/STT_MV0660_0006_76266_to_81068.wav,STT_MV,2,69,4.802,wav16k/STT_MV0660_0006_76266_to_81068.wav,ཧེ་ཧེ། ཨ་ཙི། ངས་རང་དྲ་གི་མི་འདུག་གེ རང་ལྟོས་ད། སློང་རྐྱང་རེད་ཤག
STT_MV0660_0023_186998_to_188621,ཨེ་ནས། གསོ་ཚགས་ཁང་ག་འདྲས་བྱེད་དགོས་རེད ,e nas/_gso tshags khang ga 'dras byed dgos red_,https://d38pmlk0v88drf.cloudfront.net/wav16k/STT_MV0660_0023_186998_to_188621.wav,STT_MV,2,39,1.623,wav16k/STT_MV0660_0023_186998_to_188621.wav,ཨེ་ནས་གསོ་ཚགས་ཁང་ག་འདྲས་བྱེད་དགོས་རེད།
STT_MV0660_0024_188621_to_196933,རང་ངོ་ལོག་པ་མ་བྱེད་ལ། རང་གིས་བཤད་སྟངས་ལ་ཨ། མི་ཚོ་ད་རེས་ཁ་དྲོ་གཏང་གི་ཡོད་རེད། ང་གྲུ་ཁ་བསྡད་མེད་འདུག་གེ སྤྱི་ཁྱབ་གཞོན་པ་རང་ཡོང་ང ,rang ngo log pa ma byed la/_rang gis bshad stangs la a/_mi tsho da res kha dro gtang gi yod red/_nga gru kha bsdad med 'dug ge_spyi khyab gzhon pa rang yong nga_,https://d38pmlk0v88drf.cloudfront.net/wav16k/STT_MV0660_0024_188621_to_196933.wav,STT_MV,2,127,8.312,wav16k/STT_MV0660_0024_188621_to_196933.wav,རང་ངོ་ལོག་པ་མ་བྱེད་ལ། རང་གི་བཤད་སྟངས་ལ་ཨ། མི་ཚོ་དེ་རིང་ཁ་སྤྲོ་གཏང་གི་ཡོད་རེད། ང་གྲོ་ཁག་བསྡད་མི་འདུག་གེ སྤྱི་ཁྱབ་གཞོན་པ་རང་ཡོང་ང་། ཧ
STT_MV0660_0025_196933_to_202912,ཧེ་ཧེ། ཤང་ཨར། རང་གིས་ཡོན་ཧྥིན་ལ་གང་ཡོང་ཅི་ཡོང་བྱས་སོང ,he he/_shang ar/_rang gis yon h+phin la gang yong ci yong byas song_,https://d38pmlk0v88drf.cloudfront.net/wav16k/STT_MV0660_0025_196933_to_202912.wav,STT_MV,2,54,5.979,wav16k/STT_MV0660_0025_196933_to_202912.wav,ཧེ་ཧེཧེ། ཤང་ཨར། རང་གིས་ཡོན་ཧྤིས་ལ་གང་ཡོང་ཅི་ཡོང་བྱས་སོང་
STT_MV0660_0026_202912_to_204252,པུ་གུ་འདི་ཨ་བསོད་འདུག ,pu gu 'di a bsod 'dug_,https://d38pmlk0v88drf.cloudfront.net/wav16k/STT_MV0660_0026_202912_to_204252.wav,STT_MV,2,22,1.34,wav16k/STT_MV0660_0026_202912_to_204252.wav,བུ་གུ་འདེར་ཨ་བསོད་འདུག
STT_MV0660_0027_204252_to_209856,སྐད་ཆ་ཚིག་གཅིག་གིས་ཀུང་སི་ལམ་སང་བཙུགས་ཐུབ་སོང་ང། སྐད་ཆ་ཚིག་གཅིག་གིས་དོན་དག་ག་བར་ཆོད་ཀི་རེད། རྙོག་དྲ་ཞེ་དྲག་འདུག ,skad cha tshig gcig gis kung si lam sang btsugs thub song nga/_skad cha tshig gcig gis don dag ga bar chod ki red/_rnyog dra zhe drag 'dug_,https://d38pmlk0v88drf.cloudfront.net/wav16k/STT_MV0660_0027_204252_to_209856.wav,STT_MV,2,112,5.604,wav16k/STT_MV0660_0027_204252_to_209856.wav,སྐད་ཆ་ཚིག་གཅིག་གིས་ཀུང་སི་ལམ་སང་བཙུགས་ཐུབ་སོང་ང་། སྐད་ཆ་ཚིག་གཅིག་གིས་དོན་དག་ག་བར་ཅོད་ཀི་རེད། རྙོག་དྲ་ཞེ་དྲག་འདུག
STT_MV0660_0028_209856_to_218628,རྨའེ་ཤང། ཧ་ཧ་ཧ་ཧ། ཨ་ཁུ་ཇེང་ཧྤོང། ཧེ་ཧེ་ཧེ། སོས་ཀུང་ཡོང་པེ། ཨ་ཁུ། ཨ། ཕྱག་ལས་ཡོད་པེ། གཏམ་བཟང་ཡོད་དང། གྲོང་བརྡལ་དྲག་ཆས་སྦུག་ལས་ཁ་པར་སླེབས་སོང ,rma'e shang/_ha ha ha ha/_a khu jeng h+pong/_he he he/_sos kung yong pe/_a khu/_a/_phyag las yod pe/_gtam bzang yod dang/_grong brdal drag chas sbug las kha par slebs song_,https://d38pmlk0v88drf.cloudfront.net/wav16k/STT_MV0660_0028_209856_to_218628.wav,STT_MV,2,139,8.772,wav16k/STT_MV0660_0028_209856_to_218628.wav,རྨའེ་ཤང། ཧཧཧ། ཨ་ཁུ་ཇན་ཧུང། ཧཧ་ཧ སུའ་ཧོས་ཡོང་པེ། ཨ་ཁུ།  ཕྱག་ལས་ཡོད་པེ། གཏམ་བཟང་ཡོད་ད། གྲོང་རྡལ་དྲག་ཆས་སྦུའུ་ནས་ཁ་པར་སླེབས་སོང་།
STT_MV0660_0031_236001_to_239637,ལྟོས་ད། གསེར་གི་རི་རྙེད་པ་ལས་དགའ་མདོག་ཁ། ཧེ་ཧེ་ཧེ། ཧ་ཧ། རྨའེ་ཧྲོས་བྱས་རྗེས་རྟགས་མ ,ltos da/_gser gi ri rnyed pa las dga' mdog kha/_he he he/_ha ha/_rma'e hros byas rjes rtags ma_,https://d38pmlk0v88drf.cloudfront.net/wav16k/STT_MV0660_0031_236001_to_239637.wav,STT_MV,2,82,3.636,wav16k/STT_MV0660_0031_236001_to_239637.wav,ལྟོས་ད། གསེར་གི་རི་རྙེད་པ་ལས་དགའ་མདོག་ཁ་པོ། ཧ་ཧ རྨའེ་ཧྲོས་ཀི་བྱས་རྗེས་རྟགས་མ
STT_HS0010_0256_1763592_to_1772150,དོལ་པོ་ནས་ང་ལ་ཉི་མ་མང་མོ་འགོར་གི་མ་རེད་བར་དུ། མ་རེད་ཕ་ཡུལ་ཚུར་སླེབ་ཡ་བར་དུ། ཕ་ཡུལ་ཁོ་རང་ནས་ཚུར་འོང་དུས་ད་དོལ་པོ་ལ་སླེབས་སླེབས་ལ་ཐག་རིང་པོ་འགོར་གི་རེད། དེའི་སྐབས་ནས་ཉི་མ་མང་ལོད་འགོར་སོང་བེ། པཱ་ལགས།  ,dol po nas nga la nyi ma mang mo 'gor gi ma red bar du/_ma red pha yul tshur sleb ya bar du/_pha yul kho rang nas tshur 'ong dus da dol po la slebs slebs la thag ring po 'gor gi red/_de'i skabs nas nyi ma mang lod 'gor song be/_pA lags/__,https://d38pmlk0v88drf.cloudfront.net/wav16k/STT_HS0010_0256_1763592_to_1772150.wav,STT_HS,2,198,8.558,wav16k/STT_HS0010_0256_1763592_to_1772150.wav,དོ་བོ་ནས་ང་ལ་ཉི་མ་མང་པོ་འགོར་གི་རེད་མ་རེདསླེབ་ཡ་བར་དུ། ཕ་ཡུལ་ཁོ་རང་ནས་ཚུར་ཡོང་དུས་དང་དོ་བོག་ལ་སླེབས་ལེ་ལ་ད། ཐག་རིང་པོ་འགོར་གི་རེད། དེ་་ཉི་མ་མང་ལོད་འགོར་སོང་པཱ་ལག།
