file_name,uni,wylie,url,dept,grade,char_len,audio_len,path,inf
STT_MV0663_0081_536263_to_546262,ང་ཐེར་འདོན་བྱེད་ཀི་ཡིན་ཟེར་ཨེ། ཨ་ཅག་རང་ཉོན་ཞིག དངོས་གནས་སྤྱོད་ཚུལ་ངན་པ་བཟུང་པ་ཡིན་ན། ཨ་ཅག་རང་ཏན་ཏན་ཨང་དང་པོ་བཟུང་གི་རེད། ཡེང་ཏི ,nga ther 'don byed ki yin zer e/_a cag rang nyon zhig_dngos gnas spyod tshul ngan pa bzung pa yin na/_a cag rang tan tan ang dang po bzung gi red/_yeng ti_,https://d38pmlk0v88drf.cloudfront.net/wav16k/STT_MV0663_0081_536263_to_546262.wav,STT_MV,2,128,9.999,wav16k/STT_MV0663_0081_536263_to_546262.wav,ང་ཐེར་འཐུན་བྱེད་ཀི་ཡིན་ཟེར་ཨེ། ཨ་ཅག་རང་ཉོན་ཞིག དངོས་གནས་སྤྱོད་ཟུན་ངན་པ་ཟིན་མྱི་ཡིན་ན། ཨ་ཅག་རང་ཏན་ཏན་ཨང་དང་པོ་ཟིམ་གི་རེད། ཡིན་ཏི
STT_MV0663_0083_553460_to_559501,ཧེ་ཧེ། ཡོང་ང་། ཧེ་ཧེ་ཧེ། ངས་ཁྱེད་རང་ཚོར་དགྲ་ག་རེ་བསགས་བྱུང་།  ,he he/_yong nga /_he he he/_ngas khyed rang tshor dgra ga re bsags byung /__,https://d38pmlk0v88drf.cloudfront.net/wav16k/STT_MV0663_0083_553460_to_559501.wav,STT_MV,2,62,6.041,wav16k/STT_MV0663_0083_553460_to_559501.wav,ཧཡོང་ང་། ཧ་ཧ་ཧ། ཧ། ངས་ཁྱེད་རང་ཚོར་དགྲ་ག་རེ་བསགས་བྱུང་།
STT_MV0663_0084_559501_to_565637,ཁྱེད་ཚོ་ཁ་རུབ་ཅིང། ང་དབང་ཡོད་བཤད་ཁག་བྱེད། ཅོ་བྱས་ན་འདུག་སེ་གཏན་ཁེལ་བ་ཡིན་ད། སང་ཉིན་ང་ཚོ་སློང་ཆང་གཏང་ག་ཡོང་གི་ཡིན། ཡོང་ང།  ,khyed tsho kha rub cing/_nga dbang yod bshad khag byed/_co byas na 'dug se gtan khel ba yin da/_sang nyin nga tsho slong chang gtang ga yong gi yin/_yong nga/__,https://d38pmlk0v88drf.cloudfront.net/wav16k/STT_MV0663_0084_559501_to_565637.wav,STT_MV,2,122,6.136,wav16k/STT_MV0663_0084_559501_to_565637.wav,ཁྱེད་ཚོ་ཁ་རོལ་བྱས་ང་དློང་ཡོད་བཤད་ཀ་བྱས། ཇོ། བྱས་ན་འདུག་སེ་གཏན་ཁེལ་པ་ཡིན་ད། སང་ཉིན་ང་ཚོ་སློང་ཆང་གཏང་ག་ཡོང་གི་ཡིན། ཡོང་ང་།
STT_MV0663_0088_581168_to_585898,དོན་དག་དེ་འདུག་སེ་ཐག་ཆོད་པ་རེད་བེ། འོ་འོ། སང་ཉིན་སློང་ཆང་གཏང་ག་ཕྱིན།  ,don dag de 'dug se thag chod pa red be/_'o 'o/_sang nyin slong chang gtang ga phyin/__,https://d38pmlk0v88drf.cloudfront.net/wav16k/STT_MV0663_0088_581168_to_585898.wav,STT_MV,2,70,4.73,wav16k/STT_MV0663_0088_581168_to_585898.wav,དོན་དག་འདི་འདུག་སེ་ཐག་ཆོད་པ་རེད་པེ། འོོ། སང་ཉིན་སློང་ཆང་གཏང་ག་བྱིས།
STT_TT00847_0058_346255_to_355688,ཁ་ཤས་ཀི་དེ་ཡོང་གི་འདུག་བ། དཔྱད་པ་བྱེད་སྟངས་དེ་མ་ཤེས་པའི་རྐྱེན་གྱིས། ཨེ་ནས་དཀའ་ལས་ཁག་པོ་ཆགས་བསྡད་ཡ་ཅིག བྱས་ཙང་སོ་སོའི་གིས་དཔྱད་ནས་ཅིག་བྱས་བསྡད་པ་ཡིན་ན། དཀའ་ངལ་ཅིག་ཕྲད་ཡོང་དུས་དྲི་བ་ཅིག་སླེབས་ཀི་རེད་བ།  ,kha shas ki de yong gi 'dug ba/_dpyad pa byed stangs de ma shes pa'i rkyen gyis/_e nas dka' las khag po chags bsdad ya cig_byas tsang so so'i gis dpyad nas cig byas bsdad pa yin na/_dka' ngal cig phrad yong dus dri ba cig slebs ki red ba/__,https://d38pmlk0v88drf.cloudfront.net/wav16k/STT_TT00847_0058_346255_to_355688.wav,STT_TT,2,201,9.433,wav16k/STT_TT00847_0058_346255_to_355688.wav,ཁ་ཤས་ཀིས་དེ་ཡོང་གི་འདུག་བ། དཔྱད་པ་བྱེད་སྟངས་དེ་མ་ཤེས་པའི་རྐྱེན་གིས། ཨེ་ནས། དཀའ་ལས་ཁག་པོ་ཆགས་བསྡད་ཡ་ཅིག བྱས་ཙང་སོ་སོ་གིས་དཔྱད་ནས་ཅིག་བྱེད་བསྡད་པ་ཡིན་ན། དཀའ་ངལ་ཅིག་འཕྲད་ཡོང་དུས་ དྲི་བ་ཅིག་སླེབས་ཀི་རེད་བ།
STT_MV0663_0047_336567_to_342841,ཨ་ཁུ་ཨ་ཅག་དེ་ངའི་སེམས་པའི་ཁྱད་ཡིན། ཨོ་ཙི་རང་གི་ཐུགས་འཛིན་ལ། ཧ་ཧ་ཧ། དེ་ག་རེ་ཡོད་རེད། ཧ་ཧ། སྡོད་ད། སྡོད་ད།  ,a khu a cag de nga'i sems pa'i khyad yin/_o tsi rang gi thugs 'dzin la/_ha ha ha/_de ga re yod red/_ha ha/_sdod da/_sdod da/__,https://d38pmlk0v88drf.cloudfront.net/wav16k/STT_MV0663_0047_336567_to_342841.wav,STT_MV,2,106,6.274,wav16k/STT_MV0663_0047_336567_to_342841.wav,ཨ་ཁུ། ཨ་ཅག འདི་ངས་སེམས་པའི་ཁད་ཡོད། ་ཙི། ། རང་གི་མཐོང་འཛིན་ལ ད་ག་རེ་ཡོད སྡོད་ད་སྡོད་ད
STT_MV0663_0090_593299_to_596734,རང་ལ་གེ་བྱེད་ཐུབ་ཀི་མ་རེད། ཤེས་སོང་ངེ་། ཧེ་ཡོན་ཧང་།  ,rang la ge byed thub ki ma red/_shes song nge /_he yon hang /__,https://d38pmlk0v88drf.cloudfront.net/wav16k/STT_MV0663_0090_593299_to_596734.wav,STT_MV,2,53,3.435,wav16k/STT_MV0663_0090_593299_to_596734.wav,རང་ལ་གེ་བྱེད་ཐུབ་ཀི་མ་རེད། ཤེས་སོང་ངེ་། ཧཧ། ཡོན་ཧང།
STT_MV0663_0091_596734_to_603235,རང་གིས་ཡག་པོ་ཞིག་བཅུན་ཤག རྒྱུ་མཚན་ག་རེ་ཡིན་མིན་ཤེས་ཀི་ཡོད་པེ་ཨ། མི་གདུག་རྩུབ་ཚ་བོ་ག་ཚོད་ཡོད་ནས། གང་ལྟར་ཞེད་ས་ཞིག་ཡོད་རེད།  ,rang gis yag po zhig bcun shag_rgyu mtshan ga re yin min shes ki yod pe a/_mi gdug rtsub tsha bo ga tshod yod nas/_gang ltar zhed sa zhig yod red/__,https://d38pmlk0v88drf.cloudfront.net/wav16k/STT_MV0663_0091_596734_to_603235.wav,STT_MV,2,123,6.501,wav16k/STT_MV0663_0091_596734_to_603235.wav,རང་གིས་ཡག་པོ་ཞིག་བཅུན་ཤག རྒྱུ་མཚན་ག་རེ་ཡིན་མི་ཤེས་ཀི་ཡོད་པ་ཨ། མི་གདུག་རྩུབ་ཚ་བོ་ག་ཚོད་ཡོད་མེན་གང་ལྟར་ཞེད་ས་ཅིག་ཡོད་རེད།
STT_AB00588_0004_32687_to_34889,སྐབས་ཤིག་ནས་སེ་ཆེན་ཁཱང་གི་བསམ་པར།  ,skabs shig nas se chen khAng gi bsam par/__,https://d38pmlk0v88drf.cloudfront.net/wav16k/STT_AB00588_0004_32687_to_34889.wav,STT_AB,2,35,2.202,wav16k/STT_AB00588_0004_32687_to_34889.wav,སྐབས་ཤིག་ནས་སེ་ཆེན་ཁཱང་གི་བསམ་པར།
STT_MV0663_0051_362257_to_370010,མོས་མཐུན་མེད་ན་གཡུག་བཞག་ན་ད་ག་རེད། དེ་འདྲའི་ཡིན་ནས་ཡོང་དགོས་རེད། གུས་ཞབས་མེད་པ་བྱས་ན་ཡོང་གི་མ་རེད་བ། ཧེ་ཧེ། ཧེ་ཧེ། རེད་རེད། ཅ་ལག་ཏོག་ཙི་གཅིག་ཁེར་ཡོང།  ,mos mthun med na g.yug bzhag na da ga red/_de 'dra'i yin nas yong dgos red/_gus zhabs med pa byas na yong gi ma red ba/_he he/_he he/_red red/_ca lag tog tsi gcig kher yong/__,https://d38pmlk0v88drf.cloudfront.net/wav16k/STT_MV0663_0051_362257_to_370010.wav,STT_MV,2,151,7.753,wav16k/STT_MV0663_0051_362257_to_370010.wav,མོས་མཐུན་མེད་ན་གཡུག་བཞག་ན་ད་ག་རེད། དེ་འདྲས་ཡིན་ནས་ཡོང་དགོས་རེད། གུས་ཞབས་མེད་པ་བྱས་ན་ཡོང་གི་མ་རེད་པ། ཧ་ཧ་ཧ། རེད་རེད། ཅ་ལག་ཏོག་ཙི་གཅིག་ཁེར་ཡོང་།
STT_AB00588_0005_35930_to_38950,བོད་ཡུལ་དུ་ཆོས་བརྒྱུད་མ་འདྲ་བ་འགའ་ཤས་མཆིས་ཀྱང་།  ,bod yul du chos brgyud ma 'dra ba 'ga' shas mchis kyang /__,https://d38pmlk0v88drf.cloudfront.net/wav16k/STT_AB00588_0005_35930_to_38950.wav,STT_AB,2,49,3.02,wav16k/STT_AB00588_0005_35930_to_38950.wav,བོད་ཡུལ་དུ་ཆོས་རྒྱུད་མ་འདྲ་བ་འགའ་ཤས་མཆིས་ཀྱང་།
STT_AB00588_0009_50742_to_53319,བླ་མ་འཕགས་པའི་ཆོས་བརྒྱུད་འདི་ཁོ་ན་བྱེད་བཅུག་སྟེ།  ,bla ma 'phags pa'i chos brgyud 'di kho na byed bcug ste/__,https://d38pmlk0v88drf.cloudfront.net/wav16k/STT_AB00588_0009_50742_to_53319.wav,STT_AB,2,50,2.577,wav16k/STT_AB00588_0009_50742_to_53319.wav,བླ་མ་འཕགས་པའི་ཆོས་བརྒྱུད་འདི་ཁོ་ན་བྱེད་བཅུག་སྟེ།
STT_MV0663_0080_530648_to_536263,གསལ་འགོད་པ་བཙལ་བྱས། ཨ་ཅག་རང་ལ་བཅའ་འདྲི་བྱས་ནས་མ་རབས་བྱེད་སྟངས་དེ་ཐེར་འདོན་བྱེད་ཀི་ཡིན།  ,gsal 'god pa btsal byas/_a cag rang la bca' 'dri byas nas ma rabs byed stangs de ther 'don byed ki yin/__,https://d38pmlk0v88drf.cloudfront.net/wav16k/STT_MV0663_0080_530648_to_536263.wav,STT_MV,2,88,5.615,wav16k/STT_MV0663_0080_530648_to_536263.wav,གསར་འགོད་པ་བྱས་བྱས།་ཨ་ཅག་རང་རྩད་ཁྲ་བྱས་ནས། མ་རབས་ཀི་བྱེད་སྟངས་དི་ཐེར་འདོན་བྱེད་ཀིཡིན།
STT_MV0663_0085_565637_to_575216,ཧེ་རེད། སང་ཉིན་རང་ཡོང་གི་ཡིན། བྱས་ན་ཨ་ཅག་ངེད་གཉིས་ལོག་འགྲོ། ཅོ་འགྲོ་གི་ཡིན་ད། ཡོང་ང། འགྲོ། རྒྱུགས་ཨ། ཁྱེད་ཚོ། ག་རེ་ཡིན་པའི་ཁུལ་རེད།  ,he red/_sang nyin rang yong gi yin/_byas na a cag nged gnyis log 'gro/_co 'gro gi yin da/_yong nga/_'gro/_rgyugs a/_khyed tsho/_ga re yin pa'i khul red/__,https://d38pmlk0v88drf.cloudfront.net/wav16k/STT_MV0663_0085_565637_to_575216.wav,STT_MV,2,133,9.579,wav16k/STT_MV0663_0085_565637_to_575216.wav,རེད། སང་ཉིན་རང་ཡོང་གི་ཡིན། བྱས་ན་ཨ་ཅག་ངེད་གཉིས་ལོག་འགྲོ། འོ་འོ། ཇོ་འགྲོ་གི་ཡིན་ད། ཡོང་ང་། འགྲོ རྒྱུགས་ཨ། ག་རེ་ཡིན་པའི་ཁུལ་རེད།
STT_MV0663_0079_526768_to_530648,དེ་མ་ཚད་ངས་གྲོང་སྡེའི་སྲིད་གཞུང་གི་རྒྱང་གྲགས་ས་ཚིགས་ལ་ཕྱིན་ཅིང།  ,de ma tshad ngas grong sde'i srid gzhung gi rgyang grags sa tshigs la phyin cing/__,https://d38pmlk0v88drf.cloudfront.net/wav16k/STT_MV0663_0079_526768_to_530648.wav,STT_MV,2,65,3.88,wav16k/STT_MV0663_0079_526768_to_530648.wav,དེས་མ་ཟད་ངས་གྲོང་བརྡལ་སྲིད་གཞུང་གི་རྒྱང་གྲགས་ས་ཚུགས་ཕྱིན་བྱས།
STT_MV0663_0082_546262_to_553460,རང་བསམ་ཚུལ་ག་རེ་ཡོད་མེད་ངས་གསལ་པོ་ཤེས་སོང། ཅོ། ཅོ་རང་མོས་མཐུན་ཡོད་ན། མགོ་ཀྱོག་སེ་གྱིས་ད།  ,rang bsam tshul ga re yod med ngas gsal po shes song/_co/_co rang mos mthun yod na/_mgo kyog se gyis da/__,https://d38pmlk0v88drf.cloudfront.net/wav16k/STT_MV0663_0082_546262_to_553460.wav,STT_MV,2,90,7.198,wav16k/STT_MV0663_0082_546262_to_553460.wav,རང་བསམ་ཚུལ་ག་རེ་ཡོད་མེད་ངས་གསལ་པོ་ཤེས་སོང་། ཇོ། ཇོ་རང་མོས་མཐུན་ཡོད་ན། མགོ་ཕྕོག་ཙ་གྱིས་ད།
STT_MV0663_0096_631567_to_637460,ང་ཡང་ལྷོད་ལྷོད་འདྲ་ཞིག་བྱུང་། ད་བྱས་ན་ང་གྲ་སྒྲིག་བྱེད་ཡ་མགོ་བཙུག་གི་ཡིན་ད། ང་རྟེན་འབྲེལ་ཨ་རག་ཉར་ཡ་མ་བརྗེད་པ་གྱིས་ལ།  ,nga yang lhod lhod 'dra zhig byung /_da byas na nga gra sgrig byed ya mgo btsug gi yin da/_nga rten 'brel a rag nyar ya ma brjed pa gyis la/__,https://d38pmlk0v88drf.cloudfront.net/wav16k/STT_MV0663_0096_631567_to_637460.wav,STT_MV,2,117,5.893,wav16k/STT_MV0663_0096_631567_to_637460.wav,ང་ཡེ་ལྷོད་ལྷོད་དྲ་ཞིག་བྱུང་། ད་བྱས་ན་ང་གྲ་སྒྲིག་བྱེད་ཡ་འགོ་བཙུགས་ཀི་ཡིན་ད། ང་རྟེན་འབྲེལ་ཨ་རག་ཉར་ཡ་མ་བརྗེད་པ་གྱིས་ལ།
STT_MV0663_0100_674583_to_683158,ངས་ཁྱེད་རང་གཉིས་ཞབས་འདྲེན་ཞུས་མེད། ང་དམག་མིར་ཞུགས། བྱས་རྗེས་བཞག ད་ལྟ་དམག་ཞབས་འཐེན་བྱས་ནང་ལ་བསྡད་ཡོད།  ,ngas khyed rang gnyis zhabs 'dren zhus med/_nga dmag mir zhugs/_byas rjes bzhag_da lta dmag zhabs 'then byas nang la bsdad yod/__,https://d38pmlk0v88drf.cloudfront.net/wav16k/STT_MV0663_0100_674583_to_683158.wav,STT_MV,2,102,8.575,wav16k/STT_MV0663_0100_674583_to_683158.wav,ངས་ཁྱེད་རང་གཉིས་ཞབས་འདྲེན་ཞུས་མེད། ང་དམག་མིར་ཞུ། བྱས་རྗེས་བཞག ད་ལྟ་དམག་ཤབས་ྐྱིམ་བྱས་ནང་ལ་བསྡད་ཡོད།
STT_AB00586_0004_30605_to_33029,འཕགས་པ་རིན་པོ་ཆེ་སོག་ཡུལ་དུ་ཕེབས་པའི་སྐབས་ ,'phags pa rin po che sog yul du phebs pa'i skabs _,https://d38pmlk0v88drf.cloudfront.net/wav16k/STT_AB00586_0004_30605_to_33029.wav,STT_AB,2,43,2.424,wav16k/STT_AB00586_0004_30605_to_33029.wav,འཕགས་པ་རིན་པོ་ཆེས་སོག་ཡུལ་དུ་ཕེབས་པའི་སྐབས།
STT_AB00586_0005_33626_to_39820,དགུང་ལོ་བཅུ་ལས་ཟིན་མེད་ཅིང་། ཟླ་བ་འགའ་ཤས་རིང་མྱ་ངམ་གྱི་བྱེ་ཐང་མང་པོ་བརྒྱུད་ནས་ཕེབས་དགོས་པ་དང་།  ,dgung lo bcu las zin med cing /_zla ba 'ga' shas ring mya ngam gyi bye thang mang po brgyud nas phebs dgos pa dang /__,https://d38pmlk0v88drf.cloudfront.net/wav16k/STT_AB00586_0005_33626_to_39820.wav,STT_AB,2,96,6.194,wav16k/STT_AB00586_0005_33626_to_39820.wav,དགུང་ལོ་བཅུ་ལས་ཟིན་མེད་ཅིང་། ཟླ་བ་འགའ་ཤས་རིང་མྱ་ངམ་གྱི་བྱེད་ཐང་མང་པོ་བརྒྱུད་ནས་ཕེབས་དགོས་པ་དང་།
STT_AB00586_0009_58540_to_60930,ནངས་ནུབ་ཀྱི་དུས་ཚོད་བར་གསེང་ནམ་ཡོད་ལ་ ,nangs nub kyi dus tshod bar gseng nam yod la _,https://d38pmlk0v88drf.cloudfront.net/wav16k/STT_AB00586_0009_58540_to_60930.wav,STT_AB,2,38,2.39,wav16k/STT_AB00586_0009_58540_to_60930.wav,ནངས་ནུབ་ཀྱི་དུས་ཚོད་བར་གསེང་ནམ་ཡོད་ལ་
STT_MV0663_0101_683158_to_687318,ཁྱེད་རང་བློ་བདེ་བོ་གྱིས་ཤིག ངས་གང་མགྱོགས་ལས་ཀ་ཞིག་རག་པ་བྱས་བྱས།  ,khyed rang blo bde bo gyis shig_ngas gang mgyogs las ka zhig rag pa byas byas/__,https://d38pmlk0v88drf.cloudfront.net/wav16k/STT_MV0663_0101_683158_to_687318.wav,STT_MV,2,65,4.16,wav16k/STT_MV0663_0101_683158_to_687318.wav,ཁྱེད་རང་གཉིས་བློ་བདེ་པོ་གྱིས་ཤིག ངས་གང་མགྱོགས་ལས་ཀ་ཅིག་རག་པ་བྱས་བྱས།
STT_AB00586_0025_125742_to_128029,ཆོས་རྗེ་བླ་མའི་སྐུ་ཚེ་ལ་བར་ཆད་མེད་པར་ཤོག ,chos rje bla ma'i sku tshe la bar chad med par shog_,https://d38pmlk0v88drf.cloudfront.net/wav16k/STT_AB00586_0025_125742_to_128029.wav,STT_AB,2,41,2.287,wav16k/STT_AB00586_0025_125742_to_128029.wav,ཆོས་རྗེ་བླ་མའི་སྐུ་ཚེ་ལ་བར་ཆད་མེད་པར་ཤོག
STT_AB00586_0027_133523_to_136868,སྐབས་དེར་སྐུ་འཁོར་བགྲེས་སོང་དེས་མིག་ཆུ་འདོན་བཞིན།  ,skabs der sku 'khor bgres song des mig chu 'don bzhin/__,https://d38pmlk0v88drf.cloudfront.net/wav16k/STT_AB00586_0027_133523_to_136868.wav,STT_AB,2,51,3.345,wav16k/STT_AB00586_0027_133523_to_136868.wav,སྐབས་དེར་སྐུ་ཁོར་བགྲེས་སོང་དེ་མིག་ཆུ་འདོན་བཞིན།
STT_AB00586_0028_138387_to_140930,ཆོས་རྗེ་རིན་པོ་ཆེ་སྐུ་ན་བགྲེས་པའི་ཐོག་ ,chos rje rin po che sku na bgres pa'i thog _,https://d38pmlk0v88drf.cloudfront.net/wav16k/STT_AB00586_0028_138387_to_140930.wav,STT_AB,2,39,2.543,wav16k/STT_AB00586_0028_138387_to_140930.wav,ཆོས་རྗེ་རིན་པོ་ཆེས་སྐུ་ན་བགྲེས་པའི་ཐོག
STT_MV0663_0103_691631_to_695219,ཨ་ཅག། ང་འཇོན་ཐང་མེད་ཙང།  ,a cag/_nga 'jon thang med tsang/__,https://d38pmlk0v88drf.cloudfront.net/wav16k/STT_MV0663_0103_691631_to_695219.wav,STT_MV,2,25,3.588,wav16k/STT_MV0663_0103_691631_to_695219.wav,ཨ་ཅག ང་འཇོན་ཐང་མེད་ཙང་
STT_MV0663_0104_695219_to_697659,ཨ་ཅག་རང་ལ་སེམས་ཁྲལ་བཟོས་སོང་།  ,a cag rang la sems khral bzos song /__,https://d38pmlk0v88drf.cloudfront.net/wav16k/STT_MV0663_0104_695219_to_697659.wav,STT_MV,2,31,2.44,wav16k/STT_MV0663_0104_695219_to_697659.wav,ཨ་ཅག་རང་ལ་སེམས་ཁྲལ་བཟོས་སོང་།
STT_MV0663_0106_707658_to_715465,དེ་ཚོ་བཤད་དགོས་མ་རེད། ཡག་པོ་དེ་འདྲའི་ཤོད་ད། ཧ་ཧ། ཨ་ཅག། ཇོ་ཇོ།  ,de tsho bshad dgos ma red/_yag po de 'dra'i shod da/_ha ha/_a cag/_jo jo/__,https://d38pmlk0v88drf.cloudfront.net/wav16k/STT_MV0663_0106_707658_to_715465.wav,STT_MV,2,63,7.807,wav16k/STT_MV0663_0106_707658_to_715465.wav,དེ་ཚོ་བཤད་དགོས་མ་རེད། ཡག་པོ་དེ་འདྲས་ཤོད་ད།  ཨ་ཅག ཇོ་ཇོ།
STT_MV0663_0108_721687_to_727733,ཇོ་ཇོ། བཀྲ་ཤིས་བདེ་ལེགས་ཞུ་གི་ཡིན་ད། འོ། བུ་གུ་སྐྱེ་ཡ་བསྒུག་བསྡད་ཀི་ཡིན་ད། ཧེ་ཧེ། ག་རེ་ཟེར་གི་ཡོད་རེད།  ,jo jo/_bkra shis bde legs zhu gi yin da/_'o/_bu gu skye ya bsgug bsdad ki yin da/_he he/_ga re zer gi yod red/__,https://d38pmlk0v88drf.cloudfront.net/wav16k/STT_MV0663_0108_721687_to_727733.wav,STT_MV,2,104,6.046,wav16k/STT_MV0663_0108_721687_to_727733.wav,ཧཇོ་ཇོ། བཀྲ་ཤིས་བདེ་ལེགས་ཞུ་གི་ཡིན་ད། པུ་གུ་སྐྱེ་ཡ་སྒུག་བསྡད་ཀི་ཡིན་ད། ག་རེ་ཟེར་གི་ཡོད་རེད།
STT_MV0663_0111_738733_to_747340,ཨ་མ་ལགས། སང་ཉིན་ཇོ་ཇོ་གི་ཆང་ས་བརྒྱབ་མྱི་སོང་ཙང་། ཁྱེད་རང་གཉིས་ཏན་ཏན་ཐུགས་སྤྲོ་པོ་ཡོད་རེད།  ,a ma lags/_sang nyin jo jo gi chang sa brgyab myi song tsang /_khyed rang gnyis tan tan thugs spro po yod red/__,https://d38pmlk0v88drf.cloudfront.net/wav16k/STT_MV0663_0111_738733_to_747340.wav,STT_MV,2,91,8.607,wav16k/STT_MV0663_0111_738733_to_747340.wav,ཨ་མ་ལགས། ཟང་ཉིན་ཇོ་ཇོ་ལ་ཆང་ས་བརྒྱབ་མྱི་སོང་ཙང་། ཁྱེད་རང་གཉིས་ཏན་ཏན་ཐུགས་འྤྲོ་བོ་ཡོད་རེད།
STT_MV0901_0051_279527_to_286576,ད་དུང་པང་ལེབ་དང་སྨྱུ་གུ་ཏོག་ཙི་གྲ་སྒྲིག་བྱེད་དགོས་ཀིས། ཐབས་ཤེས་སྤྱིར་བཏང་བྱས་ན་ངས་བསམ་བློ་བཏང་ཚར། འཆར་གཞི་དེ་ང་རང་ཚོས་ལག་བསྟར་བྱེད་དུས། རྙོང་འཛིང་ཚ་པོ་དེ་འདྲས་ཡོད་མ་རེད།  ,da dung pang leb dang smyu gu tog tsi gra sgrig byed dgos kis/_thabs shes spyir btang byas na ngas bsam blo btang tshar/_'char gzhi de nga rang tshos lag bstar byed dus/_rnyong 'dzing tsha po de 'dras yod ma red/__,https://d38pmlk0v88drf.cloudfront.net/wav16k/STT_MV0901_0051_279527_to_286576.wav,STT_MV,2,171,7.049,wav16k/STT_MV0901_0051_279527_to_286576.wav,ད་དུང་པང་ལི་དང་རྙེང་མ་ཏོག་ཙི་གྲ་སྒྲིག་བྱེད་དགོས་ཡོད། ཐབས་ཤེས་སྤྱིར་བཏང་བྱས་ན་ངས་བསམ་བློ་བཏང་ཚར། འཆར་གཞི་འདེ་ ང་རང་ཚོའི་ལག་ཀར་བྱེད་དུས་ གཡོག་རྩིས་ཚ་པོ་དེ་འདྲས། ཡོང་་རེད།
STT_MV0901_0052_286576_to_289728,ང་ཚོས་རང་གི་ཁ་ལ་ཉན་ཆོག། ཡོང་ང་། ཧེ་ཧེ་ཧེ།  ,nga tshos rang gi kha la nyan chog/_yong nga /_he he he/__,https://d38pmlk0v88drf.cloudfront.net/wav16k/STT_MV0901_0052_286576_to_289728.wav,STT_MV,2,43,3.152,wav16k/STT_MV0901_0052_286576_to_289728.wav,ང་ཚོས་རང་གི་ཁ་ལ་ཉན་ཆོག ཡོང་ང་། ཧ་ཧ།
STT_MV0901_0053_289728_to_297699,བྱས་ན་སྔན་ལ་འདིར་གཅིག་ལྟོས་ད། ད་ཡང་སྙིང་ག་འདྲས་སེ་བྱེད་དགོས་རེད་ཨ། གཅིག་ཤོད་ད། རང་ལྟོས་ཨ།  ,byas na sngan la 'dir gcig ltos da/_da yang snying ga 'dras se byed dgos red a/_gcig shod da/_rang ltos a/__,https://d38pmlk0v88drf.cloudfront.net/wav16k/STT_MV0901_0053_289728_to_297699.wav,STT_MV,2,91,7.971,wav16k/STT_MV0901_0053_289728_to_297699.wav,བྱས་ན་སྔན་ལ་འདིར་གཅིག་ལྟོས་ད། ད་ཡང་སྙིང་ག་འདྲས་སེ་བྱེད་དགོས་རེད་ཨ། གཅིག་ཤོད་ད། རང་ལྟོས་ཨ།
STT_MV0621_0152_1615966_to_1619000,སྣང་དག་མི་འདུག ,snang dag mi 'dug_,https://d38pmlk0v88drf.cloudfront.net/wav16k/STT_MV0621_0152_1615966_to_1619000.wav,STT_MV,2,15,3.034,wav16k/STT_MV0621_0152_1615966_to_1619000.wav,སྣང་དག་མི་འདུག
